updated_at,theme,theme_news_score,news_sentiment,summary,positive_points,negative_points,key_regions,article_based_count,title_only_count,analysis_basis,ai_enabled,error,news_count
2026-07-21 17:00:28,정유/화학,61,중립,"정유 업종은 정제마진 강세와 윤활기유 호조로 2분기에도 실적 개선 기대가 확인돼 긍정적으로 볼 수 있다. 또한 국제유가 상승, 중동 정세 불안, 호르무즈·홍해 봉쇄 우려 등은 정유업체의 제품가격과 재고 측면에서 단기적으로 우호적일 수 있다는 신호로 해석된다. 반면 석유화학은 업황 부진, 중국발 공급과잉, 나프타 스프레드 둔화, 구조조정 필요성 등 부정적인 흐름이 여전히 함께 나타나고 있어 업종 내 온도차가 크다. 금호석유화학의 R&D 확대, 고부가·친환경 소재 전환, 설비 증설은 중장기 체질 개선 요인이나, 현재로서는 실제 수주나 큰 폭의 수요 회복이 본문에서 직접 확인되지는 않는다. 따라서 전체 분위기는 정유의 실적 기대가 석유화학의 구조적 부담을 일부 상쇄하는 수준으로, 긍정과 부정이 혼재된 중립적 흐름이다.",,,,5,25,본문+제목 혼합,True,,52
2026-07-21 17:01:23,조선,67,긍정,"본문 기준으로는 조선업 슈퍼사이클, IMO 친환경 규제, LNG선·탱커 발주 증가, HD현대베트남조선 협업과 같은 수요 확대 요인이 확인되어 테마 분위기는 전반적으로 우호적이다. 세진중공업의 실적 개선과 STP·화물탱크 수요 확대, 동방선기와 세진베트남의 흑자전환처럼 실제 실적과 사업 확장이 언급된 점도 긍정적이다. 또한 미국 조선업 부활, MRO 시장 기대, HD현대의 AI 협약, LNG선 수주 호조 등 제목 기반 재료도 많아 업황 기대감을 높이고 있다. 다만 상당수 뉴스가 제목 중심이거나 기대감·전망 성격이며, 본문이 확인된 기사 수가 7건에 그쳐 수주 규모와 실적 개선의 지속성을 아직 충분히 검증하기는 어렵다. 따라서 분위기는 긍정 우세지만, 실제 수주와 실적이 더 확인되어야 하는 단계로 보수적으로 해석하는 것이 적절하다.",,,,7,23,본문+제목 혼합,True,,62
2026-07-21 17:02:10,지주/복합,61,긍정,"지주/복합 테마는 전반적으로 정책 완화와 일부 지주사의 실적·주주환원 강화 소식이 더해지며 긍정적인 분위기가 우세합니다. 특히 반도체 등 국가전략기술 분야에서 일반지주회사 손자회사의 증손회사 출자 규제를 완화하는 방안이 추진된다는 점은 그룹 차원의 투자 여력을 높일 수 있는 재료로 해석됩니다. 한솔홀딩스는 지주회사 전환 후 최대 실적을 기록했고, 자사주 소각·주주환원정책·ESG 고도화 등도 확인돼 지주사 모델의 체질 개선 신호로 볼 수 있습니다. 다만 상당수 뉴스가 제목 중심의 기대감이나 개별 기업의 주주가치 제고, 증권사 리포트에 그치고 있어 테마 전반의 실질적인 수요 증가나 대규모 수주가 광범위하게 확인되지는 않습니다. 또 일부 개별 종목은 상장 유지 우려, 적자 자회사, 수익성 부담 같은 제한 요인이 함께 보여 테마 강도를 과도하게 높게 보기는 어렵습니다.",,,,9,20,본문+제목 혼합,True,,29
2026-07-21 17:02:55,철강/소재,57,중립,"구리와 알루미늄 중심으로 비철금속 수요·가격에 우호적인 흐름이 확인되며, 중국의 구리 수입 증가와 구리 가격 강세, 전세계 구리 수요의 구조적 증가 전망이 테마에 긍정적으로 작용했다. 또한 미국이 알루미늄 공장 투자 기업에 관세를 절반으로 낮추는 정책을 발표해, 미국 내 생산 투자와 온쇼어링 유인이 강화된 점도 소재 업종에는 호재로 해석할 수 있다. 다만 다수 뉴스가 제목 기반이어서 실제 수요 증가나 실적 개선의 범위와 지속성을 본문으로 충분히 검증하기는 어렵고, 철강 관련 기사 중에는 관세 부담·노조 반발·국유화 갈등 등 부정적 요소도 함께 보인다. 미국 알루미늄 업체들의 실적과 인수 관련 보도는 가격 상승과 사업 재편 기대를 보여주지만, 동시에 생산 차질과 이익 가이던스 하향 같은 변수도 있어 업황을 일방적으로 낙관하기는 어렵다. 종합하면 철강/소재 테마는 비철금속과 알루미늄 쪽 정책·수요 기대가 지지하지만, 철강 분야의 부담과 근거 제한 때문에 분위기는 중립~약보합 혼재로 보는 것이 적절하다.",,,,6,24,본문+제목 혼합,True,,46
2026-07-21 17:04:13,통신,57,중립,"긍정적으로 볼 점은 정부의 '모두의 AI' 사업에 통신 3사와 대형 플랫폼, AI 기업들이 대거 참여하며 국내 AI·통신 인프라 활용 기대가 커졌고, 5G 업로드 경쟁과 AI 글래스, 이음5G 등 통신망 고도화 관련 이슈가 이어졌다는 점이다. 또한 해외 기사에서는 T-Mobile US와 Telekom의 실적 개선, 5G 가입자 증가, 5G·광섬유 투자 같은 실적·투자 근거가 확인돼 글로벌 통신 업황은 대체로 양호한 흐름으로 읽힌다. 다만 국내 기사 상당수는 제목 기반의 증권가 코멘트와 기대감에 머물러 있어 실제 수주·실적 개선이 본문에서 충분히 확인되지는 않았고, 일부는 요금제 고지 실효성 논란처럼 소비자 피로도나 규제 부담을 시사한다. 특히 '모두의 AI'는 무료 제공 원칙과 외산 모델 제한 등 정책적 제약이 강해, 참여 기업의 수익화 방식과 GPU 지원 범위가 향후 핵심 변수로 남는다. 종합하면 정책·AI 인프라 기대는 있으나 확인 가능한 실적 근거는 제한적이어서 분위기는 중립에서 다소 우호적 수준이다.",,,,6,24,본문+제목 혼합,True,,45
2026-07-21 17:04:44,패션/의류,56,중립,"긍정적으로 볼 점은 섬유패션업계 전반에서 AI 전환(AX) 도입을 확대하기 위한 실태조사와 맞춤형 지원책 마련이 본문에서 확인됐고, 일부 대형 브랜드는 AI 큐레이션·가상모델·챗GPT 연동 등 실제 적용 사례를 이미 내놓고 있다는 점이다. 또한 의류 순환 플랫폼 기업의 매출 급성장, 예비사회적기업 지정, K-헤리티지 컬렉션과 K패션 해외 진출 플랫폼 론칭 같은 소식은 리세일·친환경·글로벌 확장 측면의 기대를 높인다. 반면 제목 기반 기사 비중이 높아 실제 수주, 대규모 투자, 업계 전반의 실적 개선이 광범위하게 확인되지는 않았고, 중소기업·소상공인·제조 부문의 AI 도입은 비용·인력·기술 부담으로 더딘 상황이 본문에 제시됐다. 따라서 테마 분위기는 혁신과 확장 기대가 있으나, 정책·행사·플랫폼 소개 성격이 많고 아직 산업 전반의 확실한 수익화가 검증되지 않아 중립적으로 보는 것이 타당하다.",,,,8,22,본문+제목 혼합,True,,33
2026-07-21 17:05:23,플랫폼/인터넷,56,중립,"플랫폼/인터넷 테마는 AI·커머스·광고·퀵커머스 등에서 신규 서비스와 사업 확장 소식이 다수 확인돼 전반적으로는 긍정적인 흐름이 보입니다. 로젠택배의 라이브커머스 인수, 파수AI의 AI 뷰티 플랫폼 구축, 정부의 에이전트 커머스 제도 개선 논의, 네이버의 본업 성장 기대와 같은 뉴스는 플랫폼 고도화와 수요 확장 가능성을 시사합니다. 다만 상당수 기사들이 제목 중심이거나 세미나·전망성 내용이라 실제 매출 확대, 수주, 대규모 투자 집행이 본문에서 충분히 확인되지 않은 한계가 있습니다. 또한 일부 뉴스는 인터넷 범죄, 노사 갈등, 보안인증 논의처럼 업황의 구조적 리스크나 규제 부담을 드러내어 분위기를 일부 상쇄합니다. 따라서 현재 분위기는 긍정 요인이 우세하지만, 확인된 실적 개선보다 기대감과 정책 방향성에 더 많이 의존한 중립적 수준으로 보는 것이 보수적입니다.",,,,7,23,본문+제목 혼합,True,,49
2026-07-21 17:06:07,화장품/소비재,63,긍정,"본문 기준으로는 화장품·K-소비재 수출 환경이 전반적으로 우호적인 흐름을 보인다. 특히 바이오헬스 수출이 상반기 161억 달러로 역대 최대 반기 실적을 기록했고, 화장품을 포함한 수출 증가가 확인되어 업황 개선 신호로 해석할 수 있다. 코트라 보고서에서는 중국 역직구와 콘텐츠 커머스, 라이브커머스를 활용한 실제 성공 사례가 제시돼 중소 화장품·소비재 기업의 판로 확대 가능성을 보여준다. 다만 상당수 뉴스가 정책·전략 소개나 제목성 기대감에 머물러 있고, 중국 시장 진출의 규제·인증 부담, 경쟁 심화, 일부 대형 화장품사의 비핵심 자산 정리 등은 제한 요인이다. 따라서 단기 모멘텀은 긍정적이지만, 실제 개별 기업의 매출·수주로 이어지는지 확인이 더 필요하다.",,,,6,24,본문+제목 혼합,True,,36
