updated_at,theme,theme_news_score,news_sentiment,summary,positive_points,negative_points,key_regions,article_based_count,title_only_count,analysis_basis,ai_enabled,error,news_count
2026-07-16 16:29:13,정유/화학,42,중립,"정유/화학 테마에서는 중동 긴장과 호르무즈 관련 불확실성으로 국제유가가 상승하고, 나프타·원자재 공급 차질 우려가 이어진 점이 긍정적으로 해석될 수 있다. 실제 기사 본문에서도 원자재 수급 차질로 정유·화학 업종의 생산과 수출이 감소했고, 미국에서는 정유 마진(크랙 스프레드) 확대와 함께 정유주 강세가 확인됐다. 다만 이러한 흐름은 실적 개선으로 직접 연결된 개별 기업 사례보다는 지정학적 변수에 따른 단기 가격·마진 변화에 가깝고, 본문에서 국내 정유·화학 기업의 구체적인 수주나 증설, 실적 상향은 확인되지 않았다. 반대로 한국은행 보고서에는 정유·화학업이 중동전쟁 충격으로 생산 감소와 수출 둔화를 겪었다고 적시돼 있어 업황 전반의 부정 영향도 함께 반영된다. 따라서 테마 분위기는 유가 상승에 따른 기대와 공급망 불안이 공존하지만, 실질적인 펀더멘털 개선 근거는 제한적인 중립 수준으로 보는 것이 적절하다.",,,,5,25,본문+제목 혼합,True,,54
2026-07-16 16:30:16,조선,66,긍정,"본문 기준으로는 국내 조선업이 친환경 선박과 차세대 선박으로 포트폴리오를 넓히고 있다는 점이 긍정적이다. 특히 암모니아·LCO2 운반선, SMR 추진 컨테이너선 관련 기술 개발과 기본승인 소식은 중장기 경쟁력 강화 기대를 키운다. 또한 해외 선사 발주와 LNG선 확대, 일부 기업의 실적 개선 및 수주 확대 기대가 제목에서 반복돼 업황 개선 흐름은 확인된다. 다만 상당수 뉴스가 제목 기반이고, 실제 계약 규모·수익성·인도 시점이 본문에서 충분히 확인되지 않아 기대감이 선반영됐을 가능성도 있다. 일부 기사에서는 글로벌 발주 둔화, 특정 프로젝트의 불확실성, 경쟁 심화 같은 제한 요인도 보여 테마 분위기는 긍정 우세지만 과열로 보기에는 근거가 제한적이다.",,,,5,25,본문+제목 혼합,True,,62
2026-07-16 16:30:50,지주/복합,54,중립,"긍정적으로 볼 점은 알테오젠의 코스피 이전상장 유보와 무상증자, 에이피알의 2년 연속 중간배당, 한익스프레스의 자사주 매입 계획처럼 주주환원 및 밸류업 관련 뉴스가 다수 확인된다는 점이다. 또한 뉴파워프라즈마는 본업의 반도체 장비 부품 수요 확대와 자회사 실적 개선이 함께 언급되며 기업가치 재평가 기대가 제시됐다. 다만 상당수 뉴스가 제목 중심이거나 증권사 전망, 기대감, 배당 관련 내용에 머물러 있어 실제 수주 확대나 대규모 실적 개선이 본문에서 광범위하게 확인된 것은 아니다. 일부 종목은 자회사 손실, 규제 이슈, 지주회사 행위제한 해소 같은 부담 요인도 함께 보여 테마 전반이 강한 상승 국면이라기보다는 주주가치 제고와 복합기업 재평가 기대가 섞인 중립적 흐름으로 보는 것이 적절하다.",,,,8,19,본문+제목 혼합,True,,27
2026-07-16 16:31:33,철강/소재,43,중립,"본문 기준으로는 알루미늄위원회 신설과 재생 알루미늄 확대, 공급망 안정화, 통상·환경 규제 대응 추진 등 업계의 제도적 대응과 순환경제 강화 움직임이 확인돼 테마에 우호적인 재료가 있다. 또한 알루미늄의 탄소중립·에너지전환 관련 핵심 소재 역할과 캔투캔 재활용 확대 계획은 중장기 수요 기대를 뒷받침한다. 다만 본문 기사들은 대체로 협회 선임과 업계 방향성 소개에 그쳐 실제 수주, 실적 개선, 생산 확대 같은 직접적인 성과는 확인되지 않는다. 제목 기반 자료에서는 철강·석화 부진, 포스코 관련 판결 파장, 철강업계의 통상·안전·노무 부담, 구리 생산 정체 우려 등이 보여 일부 부정 요인도 존재한다. 따라서 전반적인 분위기는 구조적 기대는 있으나, 단기적으로는 기대감과 우려가 혼재된 중립적 수준으로 판단된다.",,,,6,24,본문+제목 혼합,True,,44
2026-07-16 16:32:47,통신,48,중립,"긍정적으로 볼 점은 KT·SK텔레콤·LG유플러스 등 통신사들이 정부의 ‘모두의 AI’ 사업에 참여하거나 검토 중이고, 정부가 GPU 인프라와 운영 지원을 제공해 통신사의 AI 서비스 확장 기대를 키우고 있다는 점이다. 또한 일부 제목 기사에서는 SK텔레콤의 실적·배당 정상화, 통신주의 방어주 성격, AI 인프라 투자 기대가 언급돼 투자심리 개선 흐름이 확인된다. 다만 본문에서 확인된 주요 악재로는 KT의 5G 과장광고 관련 패소와 정부 책임론, 보이스피싱 방조 관련 통신사 제재처럼 규제·평판 리스크가 존재한다. 제목 기반 기사 비중이 높아 실적 개선이나 수주, 실제 매출 증가가 본문으로 충분히 검증된 것은 아니며, AI 공모 역시 아직 사업자 선정 전 단계라 향후 성과는 불확실하다. 따라서 현재 뉴스 흐름은 AI·인프라 기대와 규제 부담이 혼재된 중립적 분위기로 해석된다.",,,,5,25,본문+제목 혼합,True,,45
2026-07-16 16:33:20,패션/의류,44,중립,"본문에서 확인되는 긍정 요인은 한세실업의 미얀마 수해 지역 의류 기부처럼 글로벌 패션 ODM 기업의 현지 활동과 브랜드 이미지를 보여주는 사례가 있다는 점이다. 또한 제목 기반 자료에서는 브랜드 모델 발탁, 패션디자인 공모전, K-패션 관련 기사처럼 업계 관심과 마케팅 활동이 이어지는 흐름이 보인다. 다만 본문 기사 다수는 사회공헌이나 환경 이슈에 집중돼 있어 실적 개선, 대규모 수주, 생산 확대, 수요 급증처럼 테마 전반의 펀더멘털 개선을 직접 확인하기는 어렵다. 오히려 의류폐기물과 생산자책임재활용제도(EPR) 도입 논의는 패션/의류 업계에 규제 부담이 커질 수 있음을 시사한다. 따라서 현재 뉴스 분위기는 일부 긍정적 소재는 있으나, 확인 가능한 실질 성장 신호와 부정적 규제 이슈가 함께 있어 중립적으로 보는 것이 적절하다.",,,,6,24,본문+제목 혼합,True,,35
2026-07-16 16:34:09,플랫폼/인터넷,52,중립,"본문 기준으로는 AI 서비스 확대, 공공 디지털서비스 시장 확대, 국가 AI 연구 플랫폼 구축, 계약 AI 플랫폼 기능 추가 등 플랫폼·인터넷/AI 관련 인프라와 활용 확장 흐름이 확인되어 긍정적으로 볼 수 있다. 또한 인그램 마이크로의 디지털 플랫폼 Xvantage처럼 AI·머신러닝을 활용한 B2B 플랫폼 고도화 사례도 있어 업계 전반의 기술 전환 방향은 우호적이다. 다만 상당수 뉴스가 제목 기반 보조 자료에 머물러 있고, 네이버 광고사업 둔화 전망, 챗GPT 서비스 오류, 깃허브 계정 유출, C커머스 소비자 피해, 방송 광고시장 감소 등 부정적 이슈도 함께 보여 분위기를 상쇄한다. 일부 기사는 단순 기대감이나 의견성 내용이어서 실적 개선, 대규모 계약, 수요 급증 같은 직접적 근거로 보기는 어렵다. 따라서 테마 분위기는 확실한 강세보다는 성장 기대와 경계 요인이 혼재된 중립 수준으로 판단된다.",,,,6,24,본문+제목 혼합,True,,48
2026-07-16 16:34:53,화장품/소비재,58,긍정,"본문 기준으로는 전통 소비재와 생활용품, 구강위생, 기초화장품 등 관련 종목에 매수세가 유입되며 테마 전반이 강세를 보였고, 케이엠제약의 포트폴리오 다각화와 해외 유통망 확대 사례, 파마리서치의 미국 화장품 제조사 인수처럼 실제 사업 확장 신호도 확인됐다. 또한 호텔 업계의 뷰티 브랜드 활용, K-뷰티 IPO 기대, 해외 유통망 확대와 증권사 목표가 상향 등은 업종 관심을 높이는 재료로 읽힌다. 다만 일부 뉴스는 제목 중심의 기대감에 머물러 있고, 본문에서도 차익실현 매물, 원재료 비용 부담, 유사 제품 논란, EU 포장규제 대응 부담처럼 기업별 리스크와 구조적 과제가 함께 언급됐다. 특히 상승 기사 중 상당수는 단기 수급과 과열 양상에 대한 설명이 포함돼 있어, 실적 개선이나 수주처럼 강한 확인 근거는 제한적이다. 종합하면 분위기는 우호적이지만, 기대감과 단기 수급에 비해 실질 성과 확인은 아직 더 필요하다는 점이 제한으로 보인다.",,,,6,24,본문+제목 혼합,True,,38
