updated_at,theme,theme_news_score,news_sentiment,summary,positive_points,negative_points,key_regions,article_based_count,title_only_count,analysis_basis,ai_enabled,error,news_count
2026-07-22 16:59:42,전자부품/PCB,66,긍정,"전자부품/PCB 테마는 AI 서버, MLCC, 반도체 기판, 전장 부품 관련 수요 기대가 다수 확인되며 전반적으로 우호적인 분위기다. 본문 기사에서는 코스모신소재의 MLCC 이형필름이 실적 하방을 지탱했고, 매출과 영업이익이 크게 개선됐으며, TTMI도 AI 인프라 확장에 따른 고다층 PCB 수요 증가와 생산능력 확대가 함께 언급됐다. 국내에서는 PCB·기판·장비주 강세, 삼성전기 프리미엄 MLCC 관련 기대, 피아이이의 AI 서버 PCB용 드릴링 솔루션 공급 등 테마성 호재가 다수 포착됐다. 다만 상당수 기사는 제목 기반이어서 실제 수주나 대규모 계약, 확정 실적 개선 여부를 확인하기 어렵고, 코스모신소재는 아직 누적 순손실이 남아 있으며 중국의 PCB 증설로 공급과잉 우려도 제기돼 제한점이 있다. 따라서 단기적으로는 분위기가 긍정적이지만, 실적과 수요가 본문에서 확정된 종목 중심으로만 보수적으로 해석할 필요가 있다.",,,,6,24,본문+제목 혼합,True,,48
2026-07-22 17:00:36,정유/화학,58,중립,"긍정적으로 볼 점은 정부가 여수 석유화학 사업재편에 7000억원 이상을 투입하고, 신규 대출·수입보험·채무유예·세제지원까지 제공하면서 구조조정과 비용 부담 완화를 직접 지원했다는 점이다. 또한 나프타와 원유에 대한 무관세 적용, 중동발 수급 불안에 대비한 원유·나프타 물량 확보 등은 정유/화학 업종의 단기 원가와 조달 리스크를 낮추는 요인으로 해석될 수 있다. 반면 여수 NCC 공장 가동 중단, 생산능력 감축, 업황 부진과 글로벌 공급 과잉이 본문에서 확인돼 업황 자체는 여전히 약하며, 지원이 곧바로 실적 개선으로 이어진다고 보기는 어렵다. 제목 기반 기사들에서도 유가 상승·중동 리스크·나프타 쇼크 같은 불안 요인이 많아 비용 압박과 변동성이 동시에 부각됐다. 따라서 이번 테마 뉴스 흐름은 정책 지원과 수급 관리의 긍정 신호가 있으나, 실질 수요 개선이나 업황 회복은 아직 제한적으로 확인되는 중립적 분위기로 보는 것이 적절하다.",,,,6,24,본문+제목 혼합,True,,54
2026-07-22 17:01:31,조선,68,긍정,"본문 기준으로는 한미 조선협력센터 개소와 대미 프로젝트 구체화 논의가 진행되고, 미국의 조선산업 재건 흐름 속에서 한국 조선사가 핵심 파트너로 언급되는 점이 긍정적이다. 또한 카타르 LNG선 1차 프로젝트가 사실상 마무리되며 2차 고선가 물량이 실적에 본격 반영될 가능성이 커져, 수주보다 실적 반영 국면으로 이동하고 있다는 점도 우호적이다. 다만 이번 뉴스들에는 실제 신규 대형 수주 확정이나 계약 규모 확대가 본문에서 충분히 확인된 경우가 제한적이고, 일부는 정책 행사·협력 기대·제목성 기사에 의존한다는 한계가 있다. 더불어 미국의 신규 관세 발표 가능성, 노사 갈등과 성과급 논란, 외국인 노동자 인력 문제 같은 변수는 업황 개선 속도에 부담이 될 수 있다. 종합하면 조선 테마의 방향성은 우호적이지만, 확인된 실적·수주 데이터와 기대성 소재가 혼재해 과도하게 강한 점수는 어렵다.",,,,8,22,본문+제목 혼합,True,,63
2026-07-22 17:02:07,지주/복합,54,중립,"긍정적으로 볼 점은 TS인베스트먼트가 AUM 확대, ROE 개선, 주주환원율 상향, 자사주 매입·소각 검토 등 기업가치 제고 계획을 구체적으로 공시했고, 대학 기술지주회사 관련 기사에서도 기술이전 실적, 자회사 수 증가, IPO 준비 등 운영 성과가 확인된다는 점이다. 또한 일부 제목 기반 자료에서 지주사 체제 전환, 자사주 매입, 중복상장 금지에 따른 지주사 재평가 기대 등 우호적인 흐름이 보인다. 다만 상당수 뉴스가 제목 기반 보조 자료에 그쳐 실질적인 실적 개선이나 대규모 수주·정책 확정처럼 강한 근거는 제한적이며, 기술지주회사 일부는 조직 축소·리더십 혼란·LP 모집 어려움 같은 제약도 드러난다. 공정위의 수평출자 허용 보도 부인처럼 제도 측면의 기대가 실제 정책으로 확인되지 않은 점도 감안해야 한다. 종합하면 테마 전반은 기업가치 제고와 구조개편 기대가 있으나, 본문에서 확인되는 성과와 한계가 함께 보여 중립적 분위기로 판단된다.",,,,9,20,본문+제목 혼합,True,,29
2026-07-22 17:02:42,철강/소재,57,긍정,"본문 기준으로는 OCI의 2분기 영업이익 흑자전환과 반도체 소재·석화 실적 개선, 전북 수출에서 비철금속이 견조하게 증가한 점이 긍정적으로 보인다. 또한 포항의 철강 공정 제조데이터 기반 AX 실증, 구리 가격 강세와 중국 현물 수요·재고 감소, 일부 알루미늄 기업의 실적 개선 및 투자 확대 소식은 철강/소재 업종 전반의 회복 기대를 뒷받침한다. 다만 상당수 뉴스가 제목 기반이어서 실제 수주·생산 확대·장기 수요 증가가 본문에서 충분히 확인된 것은 아니며, 정책·간담회·기술개발 관련 내용도 기대감 성격이 섞여 있다. 철강은 관세, 노조 반발, 경기 민감성 등 부담 요인이 함께 언급되고 있어 업황 개선이 일괄적으로 확인됐다고 보기는 어렵다. 따라서 분위기는 우세하게는 긍정적이지만, 근거 강도는 중간 수준으로 보수적으로 해석하는 것이 적절하다.",,,,6,24,본문+제목 혼합,True,,43
2026-07-22 17:03:47,통신,58,중립,"긍정적으로 볼 점은 LG유플러스가 국내 통신사 최초로 IoT 회선 1,000만을 돌파했고, 공공·산업용 원격관제와 AMI 수주를 기반으로 가입자 순증이 이어졌다는 점이다. 또한 통신사들의 AI 플랫폼 전환, 이음5G·AI 도입, 자율주행용 5G 주파수 검토 등 통신 고도화 관련 흐름도 확인돼 중장기 사업 확장 기대는 유지된다. 다만 본문에서 확인된 성과는 주로 특정 사업자(LGU+)의 IoT 확대에 집중돼 있고, 상당수 나머지 뉴스는 제목 기반이라 실제 실적 개선이나 추가 수주로 연결되는지는 확인하기 어렵다. 미국 통신사 관련 기사들도 5G·광섬유 투자와 실적, 배당을 함께 언급해 안정적이지만, 대체로 '주가 보합' 수준의 설명에 그쳐 강한 업황 모멘텀으로 보기에는 제한적이다. 전반적으로 통신 테마는 IoT·AI·5G 인프라 확장 기대가 있으나, 제목성 기대감이 많고 본문에서 광범위한 실적 개선이 확인되지는 않아 중립적 분위기로 판단된다.",,,,7,23,본문+제목 혼합,True,,45
2026-07-22 17:04:21,패션/의류,56,중립,"긍정적으로 볼 점은 K-패션커넥트 행사에 2,000명 바이어가 집결했고, 해외 바이어와 국내 브랜드가 수주전을 벌이는 모습이 본문에서 확인돼 실제 판로 확대 기대가 있다는 점이다. 삼성물산 패션의 SFDF 참여 디자이너 모집과 패션 브랜드의 콘텐츠 기업 전환 논의도 업계의 브랜드 확장과 경쟁력 강화 흐름을 보여준다. 다만 다수의 기사들이 행사 소개, 기대감, 전망 중심이어서 실제 수주 규모나 매출 개선이 확인된 내용은 제한적이다. 또한 제목 기반 기사에는 디올 관련 특검 조사처럼 업계 이미지에 부정적으로 작용할 수 있는 이슈도 포함되어 있어, 전반 분위기는 개선 기대가 있으나 아직 실적 반영을 확인하기 어려운 중립적 수준으로 판단된다.",,,,8,22,본문+제목 혼합,True,,33
2026-07-22 17:05:03,플랫폼/인터넷,55,중립,"긍정적으로 볼 점은 국내에서 한국가스공사가 AI·온톨로지 기반 AX 플랫폼 구축에 착수했고, 공공데이터 AI-Ready 지침을 반영해 내부 데이터 통합과 AI 서비스 고도화를 추진하고 있다는 점이다. 또한 제목 기준으로는 라이브커머스 도입, 퀵커머스 경쟁, AI 에이전트 커머스 실증, OTT 광고형 요금제 성과, 네이버 실적 기대 등 플랫폼/인터넷 관련 확장 신호가 다수 보인다. 다만 본문이 확인된 기사 중 상당수는 기업 내부 시스템 구축이나 전략 발표 수준으로, 실제 매출 증가·대규모 수주·실적 개선이 명확히 확인된 사례는 제한적이다. 부정적으로는 국립외교원 해킹 이슈와 ‘챗GPT 외부 플랫폼 해킹’ 제목처럼 보안 리스크가 일부 존재하고, 제목만 있는 기사 비중이 높아 테마 전반의 강한 실적 모멘텀으로 해석하기에는 한계가 있다.",,,,7,23,본문+제목 혼합,True,,49
2026-07-22 17:05:47,화장품/소비재,61,긍정,"본문 기준으로는 K뷰티의 해외 수요와 인지도 개선이 확인된다. 큐텐재팬 메가 뷰티 어워즈에서 K뷰티가 종합대상과 상위권을 휩쓴 점, 외국인 체험형 콘텐츠에서 K뷰티 제품에 대한 관심이 높게 나타난 점은 화장품/소비재 테마에 우호적이다. 다만 에코프로의 화장품 ODM 인수 추진, 코스메카코리아의 공동연구, 연우의 EU 규제 대응 세미나처럼 대부분은 사업 확장·대응 전략 수준이어서 아직 실적이나 수주로 확인되지는 않았다. 제목 기반 기사들에는 중국 소비 회복 기대, K소비재 수출 전략, 해외 판로 확대 등이 있으나, 반대로 중국 소비 회복의 불확실성, 일본 소비재 주가 약세, K뷰티 급성장의 그늘 같은 제한 요인도 함께 보여 테마 전반은 강한 호재보다는 개선 기대가 우세한 정도로 해석된다.",,,,5,25,본문+제목 혼합,True,,37
