updated_at,theme,theme_news_score,news_sentiment,summary,positive_points,negative_points,key_regions,article_based_count,title_only_count,analysis_basis,ai_enabled,error,news_count
2026-07-15 20:48:24,정유/화학,52,중립,"긍정적으로 볼 점은 호르무즈 해협 긴장과 러시아의 경유 수출 제한, 중동 정세 악화로 국제유가와 정제마진 변동성이 커지면서 정유업종의 단기 실적 개선 기대가 일부 부각된다는 점이다. 또한 일본 정부의 나프타 공급 안정 대책 검토, 국내 석유 비축시설 증설 및 나프타 비축 검토 같은 기사들은 공급망 재편과 정책 대응 필요성을 보여준다. 다만 본문에서 확인된 내용은 주로 지정학적 리스크와 정부 검토 수준에 머물러 있어, 실제 수요 증가나 대규모 수주·실적 개선이 명확히 확인된 것은 아니다. 오히려 회사채 금리 상승과 크레딧스프레드 확대, BBB급 미매각 사례는 화학·정유 기업의 자금조달 부담과 업황 불확실성을 키우는 부정 요인으로 작용한다. 따라서 테마 분위기는 단기 모멘텀은 있으나, 실적과 재무 여건 측면의 확인 가능한 개선은 제한적인 중립적 흐름으로 판단된다.",,,,6,24,본문+제목 혼합,True,,54
2026-07-15 20:49:20,조선,61,긍정,"조선 테마는 본문 기준으로 LNG선·VLCC 운항 차질과 호르무즈 해협 긴장 고조가 에너지 수송 리스크를 키우면서 해운·조선 관련 운임 및 선박 수요 기대를 자극한 점이 긍정적이다. 팬오션은 2분기 영업이익이 시장 기대를 웃돌 전망이고, LNG선과 탱커 부문의 이익 기여 확대가 언급됐으며, SK해운도 LNG선 확대와 장기계약 기반으로 사업 안정성과 현금창출력이 개선되는 흐름이 확인됐다. 또한 HD한국조선해양의 최대 실적 전망, K조선의 역대급 실적 예고, 국내 선박 수주 증가와 해외 LNG선 발주 검토 등은 업황 개선 기대를 뒷받침한다. 다만 제목 기반 뉴스 비중이 크고, 일부는 상생 행사·전망 기사처럼 직접적인 수주나 실적 확정보다는 분위기성 내용이 많아 근거 강도는 제한적이다. 또 글로벌 선박 발주 감소, 일부 조선사 목표가 하향, 개별 기업의 차입 부담 확대와 같은 부정 요인도 함께 있어 전반적으로는 긍정 우세지만 과열로 보기에는 이르다.",,,,7,23,본문+제목 혼합,True,,64
2026-07-15 20:49:55,지주/복합,52,중립,"긍정적으로 볼 점은 지주/복합 테마에서 배당 확대, 자사주 소각, 기업가치 제고, 인적분할 등 주주환원 및 지배구조 개편 관련 이슈가 다수 확인된다는 점이다. 특히 한화의 인적분할 통과와 일부 기업의 배당·자사주 소각 검토, 밸류업 테마 반응은 시장의 관심이 테마 전반에 형성돼 있음을 보여준다. 다만 상당수 뉴스가 제목 기반이며, 실제 실행 여부나 규모가 본문에서 충분히 확인되지 않아 기대감 성격이 강하다. 또한 더네이쳐홀딩스처럼 자회사 적자와 본사 재무 부담이 부각된 사례도 있어, 계열사 실적과 지주사 가치가 일괄적으로 개선된다고 보기는 어렵다. 따라서 테마 분위기는 우호적이지만, 본문으로 확인된 실질 재무 개선이나 대규모 수주보다는 밸류업 기대와 구조개편 재료가 중심인 중립적 흐름으로 판단된다.",,,,7,21,본문+제목 혼합,True,,28
2026-07-15 20:50:37,철강/소재,48,중립,"본문 기준으로는 코베스트로-BYD의 전기차·배터리·ESS용 첨단 소재 공동개발, 그리고 철강업계의 AI 데이터센터용 고부가 철강 대응, 경북도의 철강산업 경쟁력 강화·저탄소 전환 추진 등이 확인돼 테마 전반에 우호적인 재료가 일부 있습니다. 또한 중국 알루미늄 시장의 하반기 공급 부족 전망과 고철·비철금속 수출신고 의무화 같은 이슈는 일부 소재 가격이나 국내 자원 유통 환경에 영향을 줄 수 있는 재료로 볼 수 있습니다. 다만 본문 기반 기사 수가 적고, 다수 뉴스가 제목 수준이라 실제 수주·실적 개선·대규모 투자처럼 강한 근거는 제한적입니다. 더불어 미국 알루미늄 관세 관련 부담, 알루미늄 기업의 트럼프 가족기업 지급 논란 등은 업황의 불확실성과 비용 부담 요인으로 해석될 수 있습니다. 종합하면 긍정적 소재는 있으나 확인 가능한 실체가 제한적이어서, 테마 분위기는 강한 호재보다는 중립~약간 긍정 수준으로 보는 것이 보수적입니다.",,,,4,26,본문+제목 혼합,True,,46
2026-07-15 20:51:44,통신,52,중립,"본문에서 확인되는 긍정 요인으로는 세라곤 네트웍스의 멕시코 통신사 대상 관리형 서비스 계약 체결, 엔비티의 밸류업 계획과 함께 제시된 실적 개선 및 주주환원 확대, Verizon의 5G·광케이블·기업서비스 중심 투자 지속 등이 있다. 또한 다수 제목 기사에서 AI 인프라, 5G 항공망, 산업용 5G, 통신사 AX, 주주환원 기대가 언급돼 테마 관심은 유지되는 모습이다. 다만 제목 기반 기사 비중이 높아 실제 수주·매출 증가·정책 지원이 구체적으로 확인된 사례는 제한적이며, 일부 기사에서는 5G 요금 품질 논란, 결합할인 축소, 해외 통신사의 투자 둔화와 마진 압박 같은 부정적 신호도 보인다. 따라서 통신 테마는 구조적 투자와 AI 연계 기대가 있으나, 단기적으로는 기대감 중심 뉴스가 많아 강한 실적 모멘텀으로 보기에는 확인이 더 필요한 상태다.",,,,6,24,본문+제목 혼합,True,,45
2026-07-15 20:52:19,패션/의류,53,중립,"긍정적으로 볼 점은 일본 편의점 업계가 의류 매장을 확대하며 실제로 의류 매출이 매년 30% 이상 늘고, 국내에서는 빈티지·Y2K 감성 브랜드가 매출 120억 원을 기록하는 등 패션 소비와 브랜드 성장 사례가 확인된다는 점이다. 또한 K패션 공모전, 대학생 디자이너 행사, 브랜드 리뉴얼·오프라인 확장 관련 소식이 있어 업계 관심과 마케팅 활동은 이어지고 있다. 다만 상당수 뉴스가 공연, 행사, 브랜드 출범, 인터뷰성 기사처럼 기대감이나 홍보 성격이 강해 테마 전반의 실적 개선을 직접 입증하는 근거는 제한적이다. 제목 기반 기사도 많아 실제 수요 증가, 수주, 생산 확대, 업황 개선이 광범위하게 확인되었다고 보기는 어렵고, 일부는 패션과 직접 연관성이 약하다. 따라서 현재 분위기는 일부 성장 신호는 있으나 확인 가능한 실적·수요 근거가 제한적인 중립 수준으로 보는 것이 보수적이다.",,,,7,23,본문+제목 혼합,True,,35
2026-07-15 20:53:11,플랫폼/인터넷,56,중립,"긍정적으로 볼 점은 네이버의 AI 탭 누적 이용자 1,000만명 돌파, 카카오의 생성형 AI 서비스 가입자 확대처럼 플랫폼 이용자 저변이 빠르게 넓어지고 있다는 점이며, IBM의 파워 플랫폼 신제품 공개와 Ingram Micro의 AI 기반 디지털 플랫폼 언급도 플랫폼 고도화 흐름을 보여준다. 또한 퀵커머스 성장, 통합 플랫폼 구축, 소버린 AI 서비스 기대 등 제목 수준에서 플랫폼/인터넷 관련 확장 흐름이 다수 포착된다. 다만 본문 기준으로는 네이버·카카오의 수익화가 아직 초기 단계이고, 차별화 부족과 수익화 지연 우려가 함께 제기돼 실적 기여가 즉시 확인되지는 않는다. 플랫폼 노동권 개선, 5G 과장광고 쟁점, 커머스 물류투자에 따른 고정비 부담 같은 부담 요인도 일부 존재해 분위기를 강한 호재로 보기에는 제한이 있다. 전체적으로는 이용자 확대와 서비스 고도화가 긍정적이지만, 실제 매출·이익 개선이 본문에서 충분히 확인되지 않아 중립적 수준으로 판단된다.",,,,6,24,본문+제목 혼합,True,,46
2026-07-15 20:54:04,화장품/소비재,58,중립,"본문 기준으로는 중국 소비자들의 AI 추천·콘텐츠 기반 구매 확대, K-뷰티의 중국·일본 시장 맞춤형 전략, 외국인 관광객에 따른 국내 화장품 소비 개선 가능성 등이 확인되어 화장품/소비재 전반에 우호적인 흐름이 일부 보입니다. 또한 해외 큰손의 한국 상장사 투자 증가, K-뷰티 관련 ETF 언급, 코스맥스의 일본 AI 맞춤형 화장품 추진 등은 업종 관심도를 높이는 재료로 볼 수 있습니다. 다만 다수의 뉴스가 제목 중심이라 실제 수요 증가나 실적 개선이 본문으로 충분히 검증되지는 않았고, 일부 기사에서는 중국 소비 둔화와 로컬 브랜드 약진, EU 포장규제 대응 부담 같은 제약 요인도 제시됩니다. 전체적으로는 수출·채널 다변화와 AI 활용 기대가 긍정적이지만, 실제 실적 반영 여부와 규제·경쟁 심화는 추가 확인이 필요한 상황입니다.",,,,5,25,본문+제목 혼합,True,,38
