updated_at,theme,theme_news_score,news_sentiment,summary,positive_points,negative_points,key_regions,article_based_count,title_only_count,analysis_basis,ai_enabled,error,news_count
2026-07-18 15:12:31,정유/화학,57,중립,"긍정적으로 볼 점은 정유/화학 업황에서 일부 실적 개선 신호가 본문으로 확인된다는 점이다. 금호석유화학은 합성고무 시황 개선, 원재료 가격 전가, 페놀 흑자 전환 기대 등으로 시장 예상치를 웃도는 실적이 전망됐고, 업황 회복과 공급 부족이 수익성 개선에 기여한 것으로 나타났다. 또한 국제유가 급등, 호르무즈·홍해 등 공급 차질 우려, 러시아 경유 수출금지와 같은 이슈는 정유업계의 마진 개선 기대를 키우는 요인으로 읽힐 수 있다. 다만 본문 기준으로 확인된 실질 근거는 일부 개별 기업 실적과 유가 변동에 집중돼 있고, 다수 기사 제목은 공급 우려·업계 촉각·기대감 수준에 머물러 있어 강한 수요 증가나 대규모 수주가 광범위하게 확인되지는 않는다. 또한 유가 상승은 정유에는 단기 호재일 수 있지만 석화 원가 부담과 정책 리스크, 업황 재편 과정의 불확실성도 함께 존재해 테마 전체 분위기는 중립적으로 보는 것이 타당하다.",,,,6,24,본문+제목 혼합,True,,53
2026-07-18 15:13:25,조선,73,긍정,"본문 기준으로는 조선업의 수주와 사업 확장 흐름이 비교적 뚜렷하게 확인된다. 한화오션 필리조선소의 미사일시험 계측선 수주, HD한국조선해양의 VLAC·VLCC 수주, 그리고 국내 조선사들의 연간 수주 목표 70% 달성 보도는 실제 수주와 수주잔고 측면에서 긍정적이다. 또한 KOMERI와 한국AI·로봇산업협회의 협약은 조선해양 AX 전환, 자동화, 인력양성 등 중장기 경쟁력 강화 요인을 보여준다. 다만 제목 기반 기사 비중이 높아 정책 기대감, 한미 협력, 미국 진출 가능성 같은 해석성 소재가 많고, 일부 기사에는 실적·주가 해석 위주 내용도 포함돼 있어 과도한 확신은 어렵다. 따라서 단기적으로는 수주 모멘텀이 우세하지만, 실제 추가 수주 전환과 수익성 개선이 확인돼야 테마 강도가 더 높아질 수 있다.",,,,8,22,본문+제목 혼합,True,,63
2026-07-18 15:14:01,지주/복합,56,중립,"긍정적으로 볼 점은 한전기술지주의 공식 출범처럼 공공기술의 투자·사업화 연결이 본문에서 확인되고, 일부 지주사·복합 관련 종목에서 배당 확대, 자사주 소각 검토, 기업가치 제고 계획, 자회사 실적 개선 기대가 함께 언급된다는 점이다. 또한 7월부터 중복상장 금지 기대, 지주회사 재평가 기대 같은 제도적·구조적 호재성 제목들이 다수 확인되어 테마 관심은 유지되는 모습이다. 다만 상당수 뉴스가 제목 기반이거나 배당, 밸류업, 자회사 실적 전망 등 간접적 재료에 머물러 있어 실제 수주나 대규모 투자, 확정된 실적 개선을 강하게 입증하는 본문 근거는 제한적이다. 반대로 더네이쳐홀딩스의 자회사 순손실처럼 본사 재무 부담이 커지는 사례와 지주회사 행위제한 이슈, 자회사 관련 리스크가 함께 보여 테마 전반이 일방적으로 강세라고 보기는 어렵다. 따라서 현재 분위기는 구조개편·주주환원 기대가 우세하나, 확인 가능한 실적/사업 성과가 제한적이어서 중립적으로 해석하는 것이 적절하다.",,,,9,19,본문+제목 혼합,True,,28
2026-07-18 15:14:43,철강/소재,58,중립,"본문에서 확인되는 긍정 요인은 OCI홀딩스의 2분기 흑자 전환 기대와 태양광·반도체 소재 호조, Alcoa의 실적 발표에서 기록적 매출과 알루미늄 부문 개선, 그리고 CJ제일제당의 PHA 등 친환경 소재 사업 확대입니다. 또한 니켈 가격 강세와 알루미늄 시장의 공급 부족 전망, 포스코베트남의 철강 수출 거점 부상 같은 제목들은 소재 업황에 우호적인 신호로 볼 수 있습니다. 다만 일부 뉴스는 기대감이나 제목 중심 정보에 그쳐 실제 수주·증설·실적 개선이 본문으로 충분히 검증되지 않았고, 철강 공급 과잉 해소 필요성, 미국 알루미늄 관세 부담, 가격 변동성 같은 부정 요인도 함께 보입니다. 구리 전선 절도 기사와 규제·과잉 공급 관련 제목은 테마 자체의 업황 개선 신호로 해석하기 어렵고, 오히려 산업 전반의 비용·리스크를 상기시킵니다. 종합하면 소재 일부 세부 업종의 개선 신호는 있으나, 전반적으로는 긍정과 부정이 혼재해 제한적으로 해석하는 것이 타당합니다.",,,,5,25,본문+제목 혼합,True,,45
2026-07-18 15:15:54,통신,42,중립,"긍정적으로 볼 점은 통신사들의 AI 전환(AX) 청사진, 산업용 5G 추진, 통신주 순환매와 같은 업황 기대감이 일부 확인되고, 미국에서는 Verizon의 5G·광섬유 투자와 Nokia의 5G 계약 확대처럼 투자·협력 관련 소식이 보인다는 점이다. 또한 일부 기사에서는 증시 변동성 속 통신주가 방어주로 언급되고, 5G·AI 관련 테마 관심도 유지되는 모습이 확인된다. 다만 본문으로 확인된 기사 수가 5건에 그치고, 상당수가 제목 중심이라 실적 개선이나 대규모 수주처럼 강한 펀더멘털 근거는 제한적이다. 부정적으로는 KT의 5G 과장광고 관련 법원 패소와 공정위 과징금, 통신사 광고 기만 판결이 반복적으로 나타나 규제 리스크가 부각됐다. 전반적으로 테마 관심은 유지되지만, 규제 부담과 기대감 위주의 뉴스가 섞여 있어 분위기는 완만한 중립 수준으로 보는 것이 적절하다.",,,,5,25,본문+제목 혼합,True,,45
2026-07-18 15:16:27,패션/의류,56,중립,"본문 기준으로는 여름철 기능성 의류 출시와 샌들·양말 조합 재유행처럼 소비 트렌드가 살아나는 흐름이 확인되며, 일부 브랜드의 신제품과 관련 아이템 거래액 증가가 언급돼 단기적으로는 수요 모멘텀을 기대할 수 있다. 또한 무신사와 Z세대 맞춤 전략, 패션업계의 리브랜딩·팝업 확산 같은 제목들은 업계의 마케팅 활동과 타깃 확대를 시사한다. 다만 상당수 뉴스가 셀럽 스타일, 유행 소개, 제목성 기사에 머물러 있어 실제 매출 증가나 대규모 수주·실적 개선이 본문에서 충분히 확인되지는 않는다. 오히려 미국 쪽에서는 나이키가 재고 정리, 스포츠웨어 부진, 중국 압박으로 어려움을 겪는다는 부정적 본문이 있어 업황 전반을 지나치게 낙관하기는 어렵다. 종합하면 패션/의류 테마는 단기 트렌드와 신제품 효과로 분위기는 나쁘지 않지만, 실적 개선의 강한 증거는 제한적이어서 중립적으로 보는 것이 적절하다.",,,,6,24,본문+제목 혼합,True,,35
2026-07-18 15:17:10,플랫폼/인터넷,56,중립,"플랫폼/인터넷 테마는 유튜브의 광고 매출 확대, TV·쇼츠·팟캐스트로의 이용 확장, 그리고 인도네시아에서의 바이비트 현지 플랫폼 출시처럼 플랫폼 사용 시간과 사업 확장 흐름이 확인된 점에서 긍정적으로 볼 수 있다. 국내에서도 라이브커머스, 패션 플랫폼의 교환·물류 경쟁, 인터넷은행의 기업대출 확대, AI 서비스 결합 등 플랫폼의 기능 확장과 수익화 시도가 다수 언급됐다. 다만 제목 기반 뉴스가 많아 실제 매출 개선이나 수주, 가입자 급증 같은 정량적 성과는 제한적으로 확인되며, 일부 기사는 단순 성장 기대나 사업 추진 계획 수준에 머물러 있다. 또한 C커머스 소비자 불만, 대면영업 허용 논의, 금리상승 영향 등은 업황이 일방적으로 좋기만 한 것은 아님을 보여준다. 종합하면 전반적 분위기는 확장 기대가 우세하지만, 본문에서 실질 성과가 충분히 확인되지 않아 중립적으로 보는 것이 적절하다.",,,,7,23,본문+제목 혼합,True,,49
2026-07-18 15:17:54,화장품/소비재,68,긍정,"본문 기준으로는 K-뷰티의 해외 수출 성과와 유통 채널 확장이 확인돼 테마 분위기는 전반적으로 우호적이다. 충북 K-뷰티 기업들이 미국 코스모프로프에서 156억 원 규모의 수출계약을 체결했고, 기능성 화장품·스킨부스터·선케어 중심으로 상담이 활발해 실제 수출 확대 기대를 뒷받침한다. 국내에서는 약국 채널로의 진입, 더마 코스메틱 확대, 온라인 화장품 쇼핑 성장 같은 흐름이 보이며 소비재 수요가 완전히 꺾이지 않았다는 점도 긍정적이다. 다만 일부 기사들은 제목 기반이거나 업계 전망·트렌드 해석 성격이 강해, 실적 개선이 광범위하게 확인됐다고 보기는 어렵다. 또한 K뷰티의 성장 지속성, 중국 시장 재도전, 카피 의혹 같은 제한 요인도 있어 강한 호황으로 단정하기보다는 수출과 채널 다변화 중심의 개선 국면으로 보는 것이 보수적이다.",,,,6,24,본문+제목 혼합,True,,36
