updated_at,theme,theme_news_score,news_sentiment,summary,positive_points,negative_points,key_regions,article_based_count,title_only_count,analysis_basis,ai_enabled,error,news_count
2026-07-22 16:44:01,2차전지,55,중립,"긍정적으로 볼 점은 삼성SDI의 전고체 배터리 양산 기대, 에코프로비엠의 전고체 양극재 협력 가능성, 코스모신소재의 실적 개선처럼 일부 기업에서 실적과 차세대 기술 기대가 확인된다는 점이다. 또한 LG에너지솔루션의 주가 반등, 전기차 보조금, 전기차 판매 확대 관련 기사들은 수요 방어와 업황 반등 기대를 일부 뒷받침한다. 다만 본문 기준으로는 수주 확대나 대규모 증설, 정책 지원의 구체적 실행이 명확히 확인된 사례는 많지 않고, 다수 기사는 제목 수준의 기대감이나 전망에 머문다. 부정적으로는 리튬 가격 약세, 전고체 상용화 현실성 논란, 일부 업종 이슈에서의 화재·반입 제한 등 안전 우려가 함께 보이며, 중국의 과세·면세 정책 언급처럼 경쟁환경 부담도 존재한다. 따라서 현재 뉴스 흐름은 실적·기술 기대와 업황 불확실성이 혼재된 중립적 분위기로 보는 것이 타당하다.",,,,8,22,본문+제목 혼합,True,,60
2026-07-22 16:44:51,AI반도체,69,긍정,"AI반도체 테마는 HBM 수요 확대와 메모리 반도체 업황 개선 기대가 본문에서 비교적 분명하게 확인되어 전반적으로 우호적인 분위기입니다. 특히 HBM 시장의 장기 성장, 일본 무역통계에서 반도체 수출 호조로 적자폭이 줄어든 점, 해외 기사에서 메모리 반도체 공급이 여전히 타이트하다는 언급은 긍정적으로 해석할 수 있습니다. 다만 엔비디아·오픈AI·AMD 관련 기사와 중국 AI 신제품, 수출통제 강화 검토 등은 기대감과 경쟁 심화, 지정학적 변수에 대한 불확실성을 함께 보여줍니다. 또한 제목 기반 기사 비중이 높아 실제 수주, 실적, 투자 확대가 본문에서 충분히 검증된 경우는 제한적이어서 점수는 보수적으로 산정했습니다. 종합하면 수요와 실적 기대는 우세하지만, 정책·경쟁·거시 변수로 인해 확인 가능한 근거는 아직 부분적입니다.",,,,8,22,본문+제목 혼합,True,,86
2026-07-22 16:45:48,IT서비스,58,중립,"긍정적으로 볼 점은 공공·민간 영역에서 AI와 디지털 전환 관련 움직임이 이어지고 있다는 점이다. 진안군의 스마트팜 시범 구축, 롯데이노베이트의 AI·해외법인 보안 투자 확대, 삼성전자서비스의 서비스 품질 1위 사례는 IT서비스가 AI 도입, 운영 안정성, 고객 대응 강화와 연결되고 있음을 보여준다. 다만 상당수 뉴스는 제목 수준의 기대감이나 산업 동향 소개에 그치고 있어 실제 매출 증가, 대형 수주, 실적 개선이 본문에서 충분히 확인되지는 않는다. 또한 일부 기사에는 AI 서비스의 운영비·수익모델 과제, 보안 리스크 확대, 노조 이슈 등 부담 요인도 함께 보여 테마 분위기를 과도하게 낙관하기는 어렵다.",,,,8,22,본문+제목 혼합,True,,59
2026-07-22 16:46:41,건설/건자재,42,중립,"긍정적으로 볼 점은 서울시 청렴건설행정시스템이 튀르키예 현지 플랫폼으로 적용되는 등 공공건설의 투명성 제고와 시스템 확산 사례가 확인됐고, 일부 기사에서는 생활SOC 투자, 건자재 업황 개선 기대, 시멘트/건자재 기업의 사업 확장 같은 재료가 보인다. 또한 해외에서는 Building Technologies, REITs 관련 기사처럼 건설·부동산 연관 영역에서 사업 전략과 투자 관심이 이어지는 흐름이 나타난다. 다만 본문 기반 기사 수가 적고, 다수는 제목만 있어 실제 수주, 실적 개선, 대규모 투자와 같은 강한 수요 신호로 보기는 어렵다. 특히 레미콘 운송휴업으로 건설 현장 차질이 발생했다는 부정 이슈와, 시멘트 업계의 원가 부담·리스크, 건설근로자 이탈 경고 등은 업황에 부담 요인이다. 종합하면 정책·플랫폼 확산과 일부 업황 기대는 있으나, 확인된 실물 지표가 제한적이고 부정 요인도 함께 보여 테마 분위기는 중립 수준이다.",,,,7,23,본문+제목 혼합,True,,51
2026-07-22 16:47:32,게임,56,중립,"긍정적으로 볼 점은 크래프톤 5민랩의 '템빨용사'가 글로벌 누적 다운로드 100만 회를 돌파했고, 컴투스홀딩스의 신작 '페이딩 에코' 글로벌/PC·스팀·에픽게임즈 스토어 출시처럼 실제 출시와 확장이 확인된 뉴스가 다수였다는 점이다. 또한 게임이 콘텐츠산업 매출에 크게 기여했다는 데이터성 기사, 중국 판호 획득 및 현지화 추진, 하반기 신작 출시 본격화 등 업계 활동이 이어져 전반적인 모멘텀은 완전히 약하지 않다. 다만 부정적으로는 서버 종료로 게임이 사라지는 문제, 디지털 납본 사각지대, 일부 해외 업체의 게임 매출 감소처럼 구조적·보존 이슈와 실적 둔화 우려도 함께 보인다. 제목 중심 기사 비중이 높아 실제 흥행 성과나 매출 기여가 본문에서 충분히 확인되지 않은 뉴스가 많고, 기대감성 표현이 적지 않아 점수는 보수적으로 봐야 한다. 종합하면 신작 출시와 일부 성과는 긍정적이지만, 대형 수주나 뚜렷한 업황 개선이 본문에서 넓게 확인되지는 않아 분위기는 중립에 가깝다.",,,,7,23,본문+제목 혼합,True,,39
2026-07-22 16:48:13,광고/미디어,44,중립,"긍정적으로 볼 점은 콘텐츠 IP 축제 개최, 웹소설 공모전 대규모 참여, 웹툰/XR 만화 플랫폼 개발, 국가 유산 미디어아트 추진, K컬처 펀드 조성, 광고 통합 플랫폼 출시처럼 콘텐츠와 광고 기술·인프라 관련 활동이 다양하게 확인된다는 점이다. 특히 정부 주도 펀드 조성이나 지역 콘텐츠 사업, 옥외·IPTV 통합 광고 플랫폼은 테마의 구조적 확장 가능성을 시사한다. 다만 본문에서 실제 실적 개선, 대형 수주, 광고 집행 증가, 매출 성장 같은 직접적 수치가 확인된 사례는 제한적이고, 상당수 자료가 제목 기반 기대감이나 행사·출범성 기사에 그친다. 또한 방송 파행 우려, 방송업계 체감경기 냉랭, 광고시장 침체, 과장광고 제재 등 부정적 이슈도 함께 보여 테마 분위기가 뚜렷한 호재 일변도라고 보기는 어렵다. 따라서 현재 뉴스 흐름은 중립적이며, 긍정 신호는 있으나 확인 가능한 실적 모멘텀은 아직 제한적이다.",,,,7,23,본문+제목 혼합,True,,43
2026-07-22 16:48:45,금융,42,중립,"본문 기준으로는 증권주 약세와 하반기 실적 둔화 우려가 확인되며, 국내 증시는 부진한 흐름 속에서 주가 조정이 이어지고 있다. 다만 미래에셋증권처럼 일부 종목은 퇴직연금 적립금 확대와 같은 개별 모멘텀으로 상대적 선방이 언급됐고, 은행주는 기준금리 인상 기대와 NIM 개선 가능성, 높은 대출금리 환경이 일부 긍정 요인으로 거론됐다. 반면 기업은행의 변동금리 주담대 판매 중단처럼 가계대출 총량 관리가 강화되는 점은 성장 측면에서 부담 요인으로 볼 수 있다. 제목 기반 기사들에서도 은행주 강세, 보험주 이슈, 주주환원 기대 등이 보이지만 대부분 기대감·시황성 설명에 그쳐 강한 근거로 보긴 어렵다. 전반적으로 금융 테마는 일부 업종별 차별화는 있으나, 실적 개선이 본문에서 충분히 확인되지 않아 보수적으로 중립 판단이 적절하다.",,,,7,23,본문+제목 혼합,True,,42
2026-07-22 16:49:18,기계/산업재,66,긍정,"본문 기준으로는 국내외 제조업의 로봇·AI 기반 공장자동화, 설비 고도화, 생산 효율화가 동시다발적으로 언급돼 기계/산업재 테마에 우호적인 분위기가 확인된다. 특히 삼성전자의 로봇 조직 신설과 데이터 팩토리 구축, LG전자의 로보틱스사업센터 및 스마트팩토리 확대, 현대차그룹의 자율 공정·소프트웨어 중심 공장 전환, 해외의 미쓰비시전기-소니 AI 비전 센서 합작 논의는 중장기 수요 확대 기대를 뒷받침한다. 다만 상당수 뉴스가 ‘전략’, ‘전환’, ‘계획’ 수준에 머물러 있어 실제 수주·매출 반영이 확인된 사례는 제한적이며, 제목 기반 기사 비중이 높아 해석의 확실성은 낮다. 또한 기계설비 관련 도서는 산업 인식 제고에는 도움이 되지만 직접적인 실적 모멘텀으로 보기 어렵고, 일부 제목은 중장비 범죄·산업재해 공시처럼 업황과 직접 연결되기보다 규제·이미지 측면의 부담을 시사한다. 종합하면 테마 분위기는 전반적으로 개선되고 있으나, 실적과 수주로 이어지는지 추가 확인이 필요한 단계로 보는 것이 보수적이다.",,,,5,25,본문+제목 혼합,True,,38
2026-07-22 16:49:49,레저/카지노,46,중립,"긍정적으로 볼 점은 거제 둔덕복합리조트 사업이 새 사업자 타이거레저로 넘어가며 재추진 국면에 들어갔고, 내년 1월 착공 계획까지 제시됐다는 점이다. 또한 부산의 외국인 관광객 증가, 강원도의 레저 상품 출시, 해양레저 무료 체험 등 일부 기사에서 관광·레저 수요 회복과 지역 활성화 기대가 확인된다. 반면 카지노 관련 핵심 뉴스는 제도 개선 필요성 언급, 내국인 카지노 추진 철회 요구, 사기도박 적발, 관광산업 침체 등 부정적 이슈도 함께 있어 테마 전반을 강하게 끌어올릴 만큼 일관된 호재는 아니다. 본문 기반 기사에서는 실제 사업 재개나 관광 수요 확대가 확인되지만, 상당수는 제목 수준의 기대감·행사성 보도이며 카지노 업종에 직접 연결되는 실적 개선이나 수주·정책 확정은 제한적이다. 따라서 레저/카지노 테마 뉴스 분위기는 일부 개선 신호가 있으나, 규제·논란·불확실성이 함께 존재하는 중립적 수준으로 판단된다.",,,,5,25,본문+제목 혼합,True,,31
2026-07-22 16:50:39,로봇/AI,58,긍정,"로봇/AI 테마는 국내에서 휴머노이드 로봇, 로봇 디스플레이, 공장 자동화, AI 에이전트 등과 관련한 뉴스가 다수 나오며 산업 확산 기대감이 이어지는 모습이다. 본문 기준으로는 에이블랩스의 자동 피펫팅 로봇 시연처럼 실제 제품 공개와 해외 학회 참가, 삼성·LG의 로봇 디스플레이 적용 확대, 공장 자동화용 AI 비전 센서 합작법인 설립 등 사업화 신호가 확인된다. 또한 지방자치단체와 정부기관이 로봇 활용 제조혁신과 산업 육성에 나서는 점도 수요 기반 확산 가능성을 뒷받침한다. 다만 상당수 뉴스가 제목 중심의 기대감에 머물고 있고, 일부 미국 기사에서는 AI 수익화 압박과 버블 우려, 사이버 공격 같은 부정적 이슈도 제기돼 테마 강도를 과도하게 높이기 어렵다. 따라서 전반적으로는 긍정적 흐름이 우세하지만, 실제 수주·실적 개선이 본문에서 충분히 확인되는 단계는 아니어서 보수적으로 해석하는 것이 적절하다.",,,,7,23,본문+제목 혼합,True,,55
2026-07-22 16:51:30,바이오,58,중립,"본문 기준으로는 삼성바이오로직스와 셀트리온의 2분기 실적 성장 기대, 지엘팜텍의 개량신약·퍼스트제네릭 성과 확대, 에이프릴바이오의 RNA 시장 진입 등 사업 확장과 실적 개선 신호가 확인된다. 또한 동국대-아반스클리니컬 협력, 정부주도 첨단재생의료 임상 추진, 삼성바이오에피스와의 스타트업 육성 등 산업 생태계 확장에 우호적인 재료도 보인다. 다만 제목 기반 자료에는 삼성바이오로직스의 대규모 M&A와 CDMO 진출 같은 기대감성 이슈가 많고, 인보사·TG-C 관련 임상 및 FDA 불확실성, 코오롱티슈진 임상 쇼크 등 부정 요인도 포함돼 있다. 미국 사례로는 Lonza의 실적 리셋과 마진 압박이 확인돼 글로벌 CDMO 업황이 전반적으로 아주 강한 상황은 아님을 시사한다. 따라서 테마 분위기는 긍정 재료가 우세하지만, 실제 실적·수주·승인으로 확인된 내용과 기대감성 제목 뉴스가 혼재한 중립적 수준으로 보는 것이 적절하다.",,,,8,22,본문+제목 혼합,True,,57
2026-07-22 16:52:22,방산,58,중립,"미국의 이란전 장기화로 국방예산이 빠르게 소진되고 추가 예산 편성이 논의되면서, 탄약 보충·훈련·무기 구매 확대 가능성은 방산 수요 측면에서 긍정적으로 해석될 수 있다. 실제로 본문 기사에서는 미국 국방부가 약 100조원 규모의 긴급 지원을 요청했고, 일부 예산을 훈련과 무기 구매 항목에서 전용하려는 움직임도 확인된다. 또한 nLIGHT의 대형 레이저 무기 계약처럼 실제 수주 사례와 방산 주문 증가를 시사하는 기사도 있어 테마 자체의 모멘텀은 유지되고 있다. 다만 예산 통과가 의회에서 불투명하고 반전 여론 및 정치적 반대가 존재하며, 일부 기사에는 제목 위주의 기대감·해석성 내용도 많아 실질적인 수혜가 즉시 확인되었다고 보기는 어렵다. 따라서 전반적인 분위기는 긍정 요인이 있으나, 정책 집행과 수주 현실화 여부를 지켜봐야 하는 중립적 수준으로 판단된다.",,,,7,23,본문+제목 혼합,True,,62
2026-07-22 16:52:54,보안,67,긍정,"보안 테마는 전반적으로 수요 확대와 제품 고도화 흐름이 확인돼 긍정적으로 볼 수 있다. 본문 기사에서는 지슨의 상반기 매출이 전년 대비 50.8% 증가하고 2분기 영업이익이 흑자 전환했으며, 노조미 네트웍스가 RTU 내장형 보안 센서, AI 기반 OT 보안 비서, 국내외 파트너십 확대를 추진하는 등 실제 사업 확장 사례가 나타났다. 또한 오픈AI 모델의 외부 시스템 침입 사례는 보안 위협의 현실화를 보여줘 업계의 대응 수요를 키울 가능성이 있다. 다만 다수의 기사들이 제목 기반이거나 전망·세미나·MOU 중심이라 실질적인 수주, 대규모 매출 발생, 정책 집행 효과까지 본문에서 충분히 확인되지는 않았다. 따라서 테마 분위기는 우호적이지만, 일부는 기대감과 이슈성 뉴스에 의존해 있어 강한 실적 검증 단계로 보기는 어렵다.",,,,6,24,본문+제목 혼합,True,,33
2026-07-22 16:53:26,소비재,44,중립,"긍정적으로 볼 점은 일부 뉴스에서 소비쿠폰, 골목상권 회복, 중소기업 경기전망 반등, K소비재 수출 전략, 해외 역직구 확대처럼 내수와 수출 측면의 회복 기대가 확인된다는 점이다. 또한 코카콜라 가격 인상, 애플의 아이폰 임대·가격 인상, 식품 가격 인상 가능성 등은 단기적으로 소비재 기업의 매출 단가 측면에는 우호적으로 해석될 여지가 있다. 다만 본문이 확인된 뉴스는 BMW 럭셔리 브랜드 공개, 애플 관련 기사 왜곡 노출 등으로 테마 직접성과 실질 수요 증가 확인이 제한적이고, 상당수는 제목만 있어 기대감 수준에 머문다. 또한 엔화 약세에 따른 일본 소비재 주가 하락, 원자재값·내수 부진, 지르코늄 가격 인상에 따른 MLCC 원가 압박처럼 비용 부담과 업황 둔화 신호도 함께 나타난다. 종합하면 소비재 테마는 회복 기대와 가격 인상 요인이 섞여 있으나, 본문으로 확인되는 강한 실적 개선이나 대규모 수요 확대 증거는 부족해 중립적으로 보는 것이 적절하다.",,,,5,25,본문+제목 혼합,True,,40
2026-07-22 16:53:57,식품,41,중립,"식품 테마에서는 K-푸드 세계시장 확대, 식품산업 경쟁력 강화 논의, 농심·오뚜기 등 기업의 수출 확대와 설비 투자 관련 기대가 확인돼 긍정적으로 볼 수 있다. 특히 일부 기사에서는 스낵 신제품 확대, 수출공장 투자, 해외 성장 방어 등 실제 사업 확장 흐름이 언급돼 업종 모멘텀이 완전히 약하지는 않다. 다만 제목 기반 자료가 많아 구체적인 실적 개선이나 확정된 대규모 수주·수요 증가가 본문에서 충분히 확인되지는 않았고, 일부 뉴스는 단순 전망이나 해석에 그친다. 또한 해외직구 식품의 마약류 검출, 일반식품 판매 관련 행정지도, 원가·곡물가·생산비 부담 같은 부정 요인도 함께 존재해 업종 분위기를 강하게 낙관하기는 어렵다. 종합하면 성장 기대와 규제·원가 부담이 혼재한 중립적 분위기로 해석된다.",,,,7,21,본문+제목 혼합,True,,28
2026-07-22 16:54:34,엔터/미디어,57,중립,"엔터/미디어 테마는 본문 기준으로 K팝 유닛 앨범의 빌보드 선정, 직원 참여형 패션·콘텐츠 확산, 해외에서의 콘텐츠 소비 증가 같은 긍정 신호가 확인돼 분위기는 나쁘지 않습니다. 특히 몬스타엑스 셔누X형원의 앨범이 해외 매체 연간 K팝 앨범 리스트에 포함됐고, 패션업계도 MD·CEO가 직접 나서는 콘텐츠를 통해 홍보 방식을 넓히고 있어 콘텐츠화 흐름은 지속되는 모습입니다. 또 제목 기반 자료에서는 정부의 1500억원 K컬처 펀드, CJ ENM의 어워즈 후보 다수 진입, 음반 수출 확대, 유튜브 60억뷰 같은 호재가 보여 테마 관심을 받기에는 충분합니다. 다만 제목 중심 뉴스가 많아 실제 실적 개선, 대형 계약, 수익성 개선이 본문으로 충분히 확인되지는 않았고, 트로트 음반 투표나 콘서트·컴백 기대처럼 기대감성 기사 비중도 높습니다. 또한 엔터주 목표가 하향, 트와이스 재계약 우려, 아이유 콘서트·앨범 연기처럼 부담 요인도 함께 보여 전반적으로는 긍정과 부정이 혼재한 중립적 분위기로 판단됩니다.",,,,7,23,본문+제목 혼합,True,,33
2026-07-22 16:55:06,운송/항공,52,중립,"본문 기준으로는 해운·항만과 철도 물류에서 일부 긍정적인 흐름이 확인된다. 부산항만공사의 기술 혁신·창업 생태계 활성화 추진, 현대로템 고속열차의 우즈베키스탄 추가 투입과 운행 확대, 수도권 물류센터에서 우량 자산 선호와 임대료 상승 흐름은 테마에 우호적이다. 다만 대한항공의 폭염 대응 점검은 안전관리 성격이 강해 실적 개선이나 수요 확대를 직접 보여주지는 않으며, 물류센터 시장은 상온·저온 양극화와 신규 공급 축소라는 구조적 제약도 함께 나타난다. 제목 기반 뉴스에서는 HMM 운임 및 실적 기대, 항공 여객 수요 선점, 해운 탈탄소 등 긍정 신호가 있으나, 쿠팡 물류센터 화재, 항공 안전 이슈, 운임 변동성처럼 부정적 또는 불확실한 소재도 섞여 있어 전반적인 분위기는 중립적으로 보는 것이 적절하다. 본문 기반 기사 수가 7건으로 제한적이고, 상당수 제목만 제공된 점을 감안하면 강한 추세보다는 혼재된 분위기로 해석된다.",,,,7,23,본문+제목 혼합,True,,35
2026-07-22 16:55:58,원전/에너지,58,긍정,"원전/에너지 테마는 SMR 민간사업 모델 토론회, 한수원의 협력사 보안 강화, 미국 원전 설계사와의 부유식 SMR 플랫폼 개발, 체코 SMR 건설계약 체결 등으로 원전 생태계와 해외 확장 기대가 이어지는 흐름이 확인된다. 또한 미국 데이터센터 전력수요 급증으로 전력망 투자와 전력기기·전선업체의 수주 기회가 커질 수 있다는 점도 에너지 인프라 측면에서 긍정적으로 해석된다. 다만 상당수 기사들이 제목 기반 보조 자료이거나 정책·전망성 내용에 머물러 있어, 실제 매출 반영이나 대규모 수주가 본문에서 충분히 확인된 사례는 제한적이다. 태양광·RE100, 분산에너지, 전력수요 확대 등 에너지 전환 관련 이슈는 우호적이지만, 일부 기사에는 SMR 검증 필요성이나 지역 주민 대상 캠페인처럼 직접적인 사업성과와 거리가 있는 내용도 포함된다. 따라서 전체 분위기는 우호적이지만, 본문에서 확인된 실적·수주 중심의 강한 모멘텀보다는 기대와 정책 논의가 섞인 중립-긍정 수준으로 보는 것이 적절하다.",,,,7,23,본문+제목 혼합,True,,57
2026-07-22 16:56:35,유통,48,중립,"유통 테마에서는 신세계면세점의 동반 출국객 대상 쇼핑지원금 확대, 면세점 내 K-푸드 확산, 편의점 업계의 간편식 품질 개선과 퀵커머스 진화 등 소비 유도와 상품 경쟁력 강화 움직임이 확인됐다. 특히 편의점업계가 호텔 셰프와 식품 전문가를 영입하고 간편식 리뉴얼을 진행하는 등 실제 사업 운영 측면의 개선 시도가 본문에서 드러난 점은 긍정적이다. 다만 상당수 뉴스가 프로모션, 팝업, 캠페인 같은 마케팅성 내용에 그치고 있어 수요 증가나 실적 개선이 본문에서 직접 확인되지는 않았다. 또한 NC아울렛 폐점, 대구백화점 개발 불확실성처럼 일부 부정적 신호도 있어 업황이 전반적으로 뚜렷한 호전 국면이라고 보기는 어렵다. 제목 기반 기사 비중이 높아 세부 성과나 매출 효과는 확인하기 어려운 한계가 있다.",,,,5,25,본문+제목 혼합,True,,36
2026-07-22 16:57:14,인프라/배당,58,중립,"본문 기준으로는 리츠협회가 상장리츠의 공매도 제외를 금융위·거래소에 건의했고, 상업용 부동산 시장에서는 신한리츠운용의 자산 매각 추진과 같은 리츠 관련 움직임이 확인돼 배당·인프라 자산에 대한 시장 관심은 이어지고 있습니다. 또한 국내 분양 기사에서는 교통·생활 인프라가 갖춰진 대단지 공급이 늘고 있어 부동산 인프라 수요 자체는 유지되는 모습입니다. 해외에서는 고배당 종목, 배당 ETF, 배당 정상화 기대 등 배당 선호를 뒷받침하는 제목들이 다수 보이지만, 이들 대부분은 제목 수준이라 강한 근거로 보기는 어렵습니다. 반면 JR 글로벌 리츠의 회생절차 사례처럼 리츠 관련 부정 이슈도 있어, 배당·리츠 테마 전반을 강하게 낙관하기는 어렵습니다. 종합하면 긍정 요인과 부정 요인이 혼재하며, 본문에서 실제 수요 증가나 실적 개선이 뚜렷하게 확인된 뉴스는 제한적입니다.",,,,5,25,본문+제목 혼합,True,,47
2026-07-22 16:57:59,자동차,48,중립,"긍정적으로 볼 점은 볼보 ES90의 국내 출시처럼 프리미엄 전기차 신차 공개와 사전계약 호조, 유럽에서 중국차의 점유율 확대, 일부 수출 증가 기대, 해외 시장에서의 전동화 경쟁 지속 등이 확인된다는 점이다. 또한 현대차·기아의 해외 전기차 경쟁력 언급, 전기차 보조금, 하이브리드 수요 확대 같은 소재도 테마 관심을 유지시키는 요소로 보인다. 다만 현대차 목표주가 하향, 완성차 4사 파업 위기, 노무 리스크, 현대차 실적 둔화 우려처럼 국내 완성차 업종에는 부담 요인도 함께 나타난다. 제목만 있는 기사 비중이 높아 실제 수요 증가나 실적 개선이 본문에서 명확히 확인된 사례는 제한적이며, 일부 내용은 기대감이나 시장 해석에 가깝다. 따라서 자동차 테마 전반의 분위기는 신차·전동화·해외 경쟁 심화로 관심은 높지만, 실적과 노사 이슈가 섞인 중립적 흐름으로 보는 것이 적절하다.",,,,8,22,본문+제목 혼합,True,,47
2026-07-22 16:58:56,전력인프라,74,긍정,"긍정적으로 볼 점은 미국 데이터센터 전력수요가 2035년까지 현재의 약 4배로 늘고, 전체 전력 소비 비중도 20% 수준까지 확대될 수 있다는 본문 확인 내용이다. 또한 LS일렉트릭과 LG유플러스가 AI 데이터센터용 직류 전력 인프라를 공동 개발하고, 북미 빅테크향 수주 확대와 설비 증설이 이어지는 점은 전력기기·전선 업계의 실적과 수주 모멘텀을 뒷받침한다. 다만 상당수 뉴스가 기대감, 업종 전망, 주가 흐름, 또는 제목 기반 기사에 의존하고 있어 실제 추가 수주와 매출 반영 여부는 더 확인이 필요하다. 또 전력망 확충 지연, 규제 부담, 전력비용 증가 같은 역풍도 함께 언급되어 있어, 테마 강도는 높지만 단기 과열 가능성과 변동성은 경계할 필요가 있다.",,,,8,22,본문+제목 혼합,True,,70
