updated_at,theme,theme_news_score,news_sentiment,summary,positive_points,negative_points,key_regions,article_based_count,title_only_count,analysis_basis,ai_enabled,error,news_count
2026-07-15 20:29:21,2차전지,63,긍정,"본문 기준으로는 2차전지 밸류체인 전반에 긍정 요인이 더 많다. 현대차그룹-SK온 합작 공장이 미국에서 양산을 시작해 현지 납품을 개시했고, 코베스트로-BYD의 배터리·ESS 소재 공동개발처럼 공급망과 기술 협력이 이어지고 있다. 전해액 성능 개선과 가격 인하, ESS·전기차 수요 확대, 글로벌 리튬 수요 장기 성장 전망도 테마에 우호적이다. 다만 리튬 가격 하락, 중국 EV 수요 둔화, 공급 과잉 우려, 일부 뉴스는 제목 중심의 기대감성 보도라는 점은 제한적이다. 따라서 단기 모멘텀은 긍정적이지만, 실제 실적 개선과 주문 확대가 본문에서 충분히 확인된 종목과 그렇지 않은 종목 간 온도차는 크다.",,,,7,23,본문+제목 혼합,True,,56
2026-07-15 20:30:11,AI반도체,68,긍정,"긍정적으로 볼 점은 삼성전자 HBM 1위 가능성 전망, SK하이닉스 ADR에 대한 월가 관심, 한미반도체의 HBM 장비 생산 확대와 미국 법인 설립 계획, Hanmi Semiconductor의 기록적 마진과 주가 급등처럼 AI반도체 공급망 전반에서 실적·설비투자 기대가 확인됐다는 점이다. 또한 TSMC 실적을 앞두고 AI 수요, 첨단공정, 고급 패키징(CoWoS)과 CAPEX 확대가 핵심 관전 포인트로 제시돼, 업황 자체는 여전히 견조한 흐름으로 해석된다. 반면 여러 기사 상당수는 제목 중심의 기대감·전망성 내용에 머물러 있고, 일부는 중국 수출 경쟁, 메모리 주가 급락, 밸류에이션 부담처럼 변동성과 불확실성을 함께 보여준다. 특히 AI 수요 지속성은 아직 실적 발표와 추가 수주로 더 확인이 필요하며, 일부 뉴스는 정책·지정학 이슈(UAE 수출통제 완화 등)와 연관돼 직접적인 업황 개선으로 단정하기 어렵다. 종합하면 AI반도체 테마의 분위기는 대체로 우호적이지만, 확정된 대규모 수주보다 기대와 실적 검증이 혼재된 단계로 보는 것이 보수적이다.",,,,8,22,본문+제목 혼합,True,,85
2026-07-15 20:31:32,IT서비스,61,긍정,"네이버 AI탭 이용자가 1,000만명을 넘고, 검색·쇼핑·부동산·브라우저·건강 등과 연동을 넓히는 내용은 IT서비스의 AI 적용이 실제 사용자 확대로 이어지고 있음을 보여준다. 다음의 AI오버뷰가 국산 NPU와 LLM을 활용한 첫 풀스택 소버린AI 서비스로 운영을 시작한 점도 국산 AI 인프라와 서비스 결합 측면에서 긍정적으로 해석할 수 있다. 또한 교육청, 보험사, 지자체, 통신사 등에서 디지털 전환과 AI 도입을 시사하는 제목들이 다수 확인돼 테마 관심도는 높은 편이다. 다만 제목 기반 뉴스 비중이 크고, 다수 기사에서 수익화는 초기 단계이거나 기대감 중심이라는 점이 확인되어 실질적인 실적 기여는 아직 제한적으로 보인다. 또 SI 업계의 채용 축소, 노조 대응, 보안투자 확대처럼 비용 부담과 구조적 압박을 시사하는 신호도 있어, 분위기는 우호적이지만 강한 실적 모멘텀으로 단정하기는 어렵다.",,,,8,22,본문+제목 혼합,True,,59
2026-07-15 20:32:42,건설/건자재,47,중립,"본문 기준으로는 반도체 클러스터, 대형 SOC, 건설현장 안전관리, 시멘트 업계의 현지 공급망 강화 등 건설/건자재 수요를 뒷받침할 수 있는 요소가 일부 보입니다. 특히 반도체 관련 투자 속도전과 정부의 자본시장·부동산 비중 축소 기조는 일부 지역 개발과 인프라 수요 기대를 자극할 수 있습니다. 다만 부동산 비중 축소, 건설경기 회복 지연, 대출 조임, 착공·준공 감소, 폭염에 따른 현장 리스크 같은 부정적 요인도 함께 확인되어 업황이 강하게 개선됐다고 보기는 어렵습니다. 또한 상당수 기사와 제목만으로 확인된 내용은 기대감이나 해설 성격이 강해 실제 수주·실적 개선 여부를 판단하기엔 한계가 있습니다.",,,,4,26,본문+제목 혼합,True,,51
2026-07-15 20:33:37,게임,58,중립,"긍정적으로 볼 점은 크래프톤의 신작 글로벌 출시와 게임패스 데이원 탑승, 넥슨게임즈의 메가 IP 기반 신작 출시 기대, 카카오게임즈 ‘오딘’의 매출 1위 재탈환처럼 일부 주요 타이틀에서 출시·흥행·매출 개선 신호가 확인된다는 점이다. 또한 스팀의 상반기 매출이 역대 최고를 경신했다는 제목성 소식과 퍼블리셔 출범, 신작 출시 소식들이 다수 보여 전반적인 신작 공급과 시장 활동성은 유지되는 모습이다. 다만 웹젠의 영업이익 감소, 드래곤소드 분쟁에 따른 환불 이슈, 중국 판호 지연으로 인한 K-게임 기회 상실 같은 부정 요인도 함께 확인돼 업계 전반이 일방적으로 개선되고 있다고 보기는 어렵다. 제목 기반 뉴스가 많아 실제 수요 증가나 실적 개선이 본문에서 충분히 검증된 사례는 제한적이며, 상당수는 출시·기대감·전망 중심이라 테마 분위기를 강하게 끌어올릴 정도의 근거로 보기는 어렵다.",,,,7,23,본문+제목 혼합,True,,39
2026-07-15 20:34:21,광고/미디어,46,중립,"본문 기준으로는 공영방송 이사 임명 제청, 시청자미디어센터의 여름방학 미디어 교육 운영, 지역의 AI·미디어아트 전시 등 광고/미디어 관련 제도·교육·콘텐츠 활동이 이어져 테마의 존재감은 확인된다. 또 제목 기준으로는 광고 재개, 글로벌 콘텐츠 마케팅 강화, AI 콘텐츠 도시 조성, 콘텐츠 수출 상담회 등 확장 기대를 자극하는 소재가 다수 보인다. 다만 본문에서 확인되는 내용은 대체로 교육 프로그램·행정 절차·행사 성격이 강해 실제 수주, 매출 증가, 대규모 투자, 광고 집행 확대 같은 직접적인 실적 개선 근거는 제한적이다. 또한 ‘스페이스X ETF 과장 광고 의혹’처럼 광고 관련 부정 이슈도 포함되어 있어 분위기를 크게 끌어올리기 어렵다. 종합하면 테마 관심도는 유지되지만, 본문 근거가 약하고 제목 기반 기대감 비중이 커서 보수적으로 중립 수준으로 보는 것이 적절하다.",,,,6,24,본문+제목 혼합,True,,42
2026-07-15 20:34:52,금융,55,중립,"본문 기준으로는 증권주가 코스피·코스닥 급등에 강세를 보였고, 미국 은행주는 실적 호조와 금리 수준, 트레이딩·IB(투자은행) 수익 기대에 힘입어 양호한 분위기가 확인된다. 국내 은행주도 신고가 소식과 NIM 반등 사례가 있어 일부 종목의 이익 체력 개선 기대를 뒷받침한다. 다만 보험주에서는 과잉진료 논란이 재점화됐고, 제목 기반 자료에는 금리 인상 우려, 증권주 장기 부진, 일부 종목 등급 하향 등 부담 요인이 함께 나타난다. 또한 대부분의 국내 뉴스는 제목 중심이라 실적 개선이나 정책 효과가 본문에서 충분히 검증되지 않았고, 단기 순환매 성격의 상승 해석도 있어 테마 전반을 강하게 낙관하기는 어렵다.",,,,4,26,본문+제목 혼합,True,,41
2026-07-15 20:35:41,기계/산업재,57,중립,"긍정적으로 볼 점은 중진공이 탄소규제 대응을 위한 설비투자 지원사업을 통해 협력 중소기업의 에너지 고효율·탄소저감 설비 도입 비용을 기업당 최대 3억 원까지 지원하고, 올해 140개사 지원 계획을 제시했다는 점이다. 또한 삼양컴텍의 로봇 자동화 추진 및 제조로봇·첨단제조로봇 실증사업 선정, 국산 K-AI 모델의 스마트공장 확산, 대형 로봇 자동화 시스템 공급 등은 기계·산업재 수요와 자동화 투자 확대 기대를 뒷받침한다. 다만 기사 상당수가 제목 기반 보조 자료이고, 본문 확인이 가능한 뉴스도 정책 설명과 간담회 중심이라 실제 대규모 수주나 실적 개선이 직접 확인된 것은 제한적이다. 일부 뉴스는 산업재해, 규제 공시 부담, 일본 기계수주 감소 같은 부정 또는 부담 요인도 포함돼 있어 전반적 분위기는 우호적이지만 강한 추세로 보기에는 근거가 분산돼 있다. 따라서 현재 테마 분위기는 정책 지원과 자동화 투자 기대가 우세하나, 실적 반영과 수주 확대 여부는 추가 확인이 필요하다.",,,,6,24,본문+제목 혼합,True,,40
2026-07-15 20:36:24,레저/카지노,57,중립,"긍정적으로 볼 점은 중국 관광 회복과 외국인 관광객 증가가 확인되고, 일본의 관광 소비액도 분기 기준 역대 최고를 기록하는 등 아시아권 전반의 여행 수요가 견조하다는 점이다. 국내에서도 서산의 중국 단체관광 재방문, 인천·제주·서울·수원 등에서 관광 활성화 및 호텔/리조트 관련 언급이 이어져 레저·호텔 수요 개선 기대를 자극한다. 특히 제주 드림타워의 ‘원스톱 체류’ 실적 비결, 호텔·백화점 멤버십 연계, 블레저 관광 확대는 카지노·호텔 업종에 우호적인 분위기로 해석될 수 있다. 다만 새만금 카지노는 사회적 합의와 신중론이 부각되고, 강원랜드 관련 규제 수정 이슈와 롯데관광개발 급락처럼 정책·규제 부담도 함께 확인된다. 또한 다수 뉴스가 제목 기반 보조 자료라 실제 수요 증가나 실적 개선이 본문으로 충분히 검증된 사례는 제한적이어서, 전체 분위기는 긍정과 부정이 혼재된 중립 수준으로 보는 것이 보수적이다.",,,,6,24,본문+제목 혼합,True,,34
2026-07-15 20:37:17,로봇/AI,61,긍정,"로봇/AI 테마는 전반적으로 긍정적 흐름이 우세하다. 본문 기반 기사에서 최태원 대한상의 회장의 AI 전환(AX) 강조와 조직 재설계 필요성, 그리고 유락의 현장형 AI 포렌식 해외 공략처럼 실제 사업 적용과 시장 확장 의지가 확인됐다. 제목 기반 기사들에서도 휴머노이드 로봇의 기능 고도화, 로봇 생산 확대, AI·로봇 메가 프로젝트, 자동화 시스템 공급 등 테마에 우호적인 소재가 다수 보였지만, 상당수는 제목만 확인돼 실제 수주·실적 개선 여부는 검증이 부족하다. 한편 AI 도입의 필요성, 교육·기술 소개, 연구 제안 등은 기대감을 높이지만 단기 실적 기여를 직접 보여주지는 않으며, 일부는 기대성 기사에 그친다. 따라서 분위기는 우호적이지만, 본문에서 명확히 확인된 대규모 수주나 실적 개선은 제한적이라 점수는 보수적으로 산정했다.",,,,4,26,본문+제목 혼합,True,,54
2026-07-15 20:38:08,바이오,62,긍정,"바이오 테마는 FDA 승인, 희귀의약품 지정, 공급계약 체결, AI 기반 신약개발 협업 등 실제 사업성과를 보여주는 뉴스가 다수 확인돼 전반적으로는 우호적인 분위기다. 특히 에스티팜의 공급계약과 HLB의 FDA 실사 결과 관련 기대, 셀큐이티의 유방암 치료제 FDA 승인, 에트노바테라퓨틱스의 희귀의약품 지정은 구체적 모멘텀으로 볼 수 있다. 다만 일부 뉴스는 제목 중심의 기대감이나 개발 과정 설명에 그치고, '국내 바이오기업 특허의 양적 강세 대비 질적 경쟁력 저하'처럼 구조적 한계도 함께 제시된다. 또한 진원생명과학의 CDMO 생산·판매중단 조회공시는 개별 종목 기준의 부정적 변수로 해석될 수 있어, 업황 전반을 강하게 낙관하기에는 제한이 있다. 종합하면 긍정 재료가 우세하지만, 실제 매출·허가·임상 성과로 확인되는 범위와 제목 기반 기대감 사이의 간극을 감안해야 하는 분위기다.",,,,7,23,본문+제목 혼합,True,,55
2026-07-15 20:39:03,방산,66,긍정,"방산 테마는 전반적으로 우호적인 분위기다. 본문에서 미국의 대규모 국방예산 집행, THAAD 요격체 증산 계약, 세계 군사비 지출 역대 최고치, 그리고 한국 중기부의 방산 스타트업 지원 확대가 확인돼 수요와 정책 측면의 긍정 요인이 있다. 특히 실제 계약 발주와 정부 지원처럼 구체적인 실행 사례가 있어 단순 기대감보다 신뢰도가 높다. 다만 일부 뉴스는 사설·해설·제목 중심 자료가 많아 수주나 실적 개선이 직접 확인된 범위는 제한적이며, 미국 국방예산 통과 불확실성, 주52시간 규제 이슈, 캐나다 잠수함 수주 실패 같은 부정 요인도 함께 보인다. 따라서 단기적으로는 긍정 흐름이 우세하지만, 실제 실적 반영과 추가 수주 여부는 더 확인이 필요하다.",,,,8,22,본문+제목 혼합,True,,63
2026-07-15 20:39:36,보안,56,중립,"긍정적으로 볼 점은 국내외에서 보안 서비스 확대, AI-SOC 출시, 정부 혁신제품 지정, 망분리 완화 논의 등 보안 수요와 제도 변화에 맞춘 사업 기회가 다수 확인된다는 점이다. 특히 노바인시큐-크로커스의 협업, 베스핀글로벌의 AI 기반 보안관제 출시, 파인더갭 취약점 관리 솔루션의 정부 혁신제품 지정은 실제 제품·서비스 출시와 시장 진입 시도가 본문에서 확인돼 테마에 직접적인 관련성이 있다. 다만 상당수 뉴스가 제목 기반 보조 자료에 머물러 있어 실제 수주, 매출 증가, 대규모 투자처럼 강한 실적 근거는 제한적이며, 일부는 칼럼·전망성 기사로 구성돼 있다. 또한 레이어제로 해킹, 티빙 해킹 등 보안 사고 뉴스도 있어 업종 전반의 수요 확대 가능성은 있지만, 단기적으로는 위협 확대와 대응 비용 증가라는 부정적 해석도 함께 존재한다. 종합하면 보안 테마의 관심도는 높지만, 본문 기반의 확정적 호재보다는 기대와 정책 변화, 사고 이슈가 혼재된 중립적 분위기로 보는 것이 적절하다.",,,,7,23,본문+제목 혼합,True,,31
2026-07-15 20:40:17,소비재,52,중립,"긍정적으로 볼 점은 백화점·편의점 소비 회복 기대, 민생회복 소비쿠폰, 화장품과 K-소비재의 해외 경쟁력 및 중국 소비재 진출 전략 관련 기사들이 이어지며 소비재 전반에 대한 관심이 살아나고 있다는 점이다. 또한 일부 기사에서는 자동차 생산·내수·수출 증가, 정부의 경기회복 흐름 진단처럼 소비 및 경기 개선 신호가 확인된다. 다만 본문이 확인되는 기사 중 상당수는 NH농협캐피탈의 브랜드 출범처럼 소비재 업종과 직접 관련이 약한 내용이고, 제목 기반 기사도 기대감·전망성 표현이 많아 실질 수요 개선을 강하게 입증하진 못한다. 부정적으로는 중국 내수 부진과 투자 둔화, 프랜차이즈와 가전·식품에서의 가격 인상 압박, 물가·고용 부담 같은 비용 측면 리스크가 함께 보인다. 따라서 테마 분위기는 개선 기대가 우세하지만, 실제 소비 확대로 이어지는지와 기업 실적 개선 여부는 추가 확인이 필요한 단계다.",,,,4,26,본문+제목 혼합,True,,40
2026-07-15 20:40:54,식품,48,중립,"긍정적으로 볼 점은 K-푸드 수출 확대, 라면 생산기지 투자, 식품안전·기술 인증 강화처럼 산업 경쟁력과 해외 확장 가능성을 보여주는 소재가 다수 보인다는 점이다. 특히 상반기 K-푸드 수출이 역대 최대 수준이라는 제목 기반 소식과 오뚜기라면의 수출 전진기지 투자, 농심의 AI 수출공장 완공 임박 같은 내용은 중장기 성장 기대를 높인다. 다만 본문에서 직접 확인된 뉴스는 오뚜기의 식품안전 심포지엄 개최처럼 비교적 간접적이고, 동시에 고환율·원가 압박으로 식품업계가 가격 인상에 나서는 부정적 흐름이 강하게 나타난다. 또한 오뚜기의 지난해 영업이익 감소 사례처럼 비용 부담이 실제 실적에 영향을 주고 있어, 단기적으로는 수익성 압박이 테마 전반의 분위기를 제한한다. 따라서 현재 테마 분위기는 수출·투자 기대와 원가 상승 부담이 공존하는 중립적 흐름으로 보는 것이 보수적이다.",,,,7,22,본문+제목 혼합,True,,29
2026-07-15 20:41:34,엔터/미디어,54,중립,"긍정적으로 볼 점은 K팝·엔터 관련 콘서트, 데뷔, 팬덤 활동, 해외 진출 상담회 등 테마 내 이벤트가 다수 확인되며, 일부 기사에서는 글로벌 화제성이나 콘텐츠 확장 흐름이 언급된다는 점이다. 또한 온유의 단독 콘서트, 에이티즈 산의 글로벌 안무 화제처럼 아티스트 중심의 관심도는 유지되는 모습이다. 다만 본문이 확인된 기사들 중 다수는 공연 소식이나 화제성 소개에 그쳐 실제 수익 개선, 대규모 수주, 정책 지원, 공급 계약 같은 실질적 성과는 제한적으로 보인다. 부정적으로는 와이지엔터 2분기 실적이 기대를 밑돌 것이라는 제목 기반 보도가 있어 업종 전반의 실적 기대는 다소 약해졌고, 제목만 있는 기사 비중이 높아 상승 근거의 확실성도 낮다. 따라서 테마 분위기는 전반적으로 유지되지만, 확실한 실적·사업 성과 확인 전까지는 보수적으로 해석하는 것이 적절하다.",,,,7,23,본문+제목 혼합,True,,33
2026-07-15 20:42:21,운송/항공,52,중립,"긍정적으로 볼 점은 대한항공의 화물운임 강세와 영업이익 개선 기대, 제주항공의 여객 운송 확대, 그리고 우주항공복합도시 특별법 논의처럼 운송·항공 업황과 산업 기반을 뒷받침할 수 있는 재료가 확인된다는 점이다. 또한 네이버의 물류 직계약(FBN) 확대와 항공수색대 창설, AI물류교육센터 같은 소식은 물류·항공 관련 인프라와 활용 범위가 넓어질 가능성을 보여준다. 다만 여러 기사에서 고유가, 운임 하락, 중동 리스크, 해운 제재 등 비용과 공급망 불확실성을 시사하는 부정적 요인도 함께 나타나며, 대한항공의 경우 매출은 늘어도 순이익이 적자 전환했다는 제목이 있어 수익성은 아직 불안정하다. 제목 기반 기사 비중이 높아 세부 수치와 실제 실적 개선 폭을 충분히 확인하기 어렵고, 정책·기대감 성격의 뉴스도 많아 테마 전반을 강하게 긍정적으로 보기에는 제한이 있다.",,,,7,23,본문+제목 혼합,True,,37
2026-07-15 20:43:18,원전/에너지,56,중립,"긍정적으로 볼 점은 신한울 3·4호기 참관단 가동, 원자력연구원 직무대행 체제와 재공모에도 불구하고 SMR·사용후핵연료 관리·원전 안전기술 등 핵심 연구개발이 계속 언급되고 있으며, 일부 제목에서는 정부의 원전 확대 기조와 전력수요 증가, SMR 개발·슈퍼컴 구축, 원전 공급망 강화 기대가 확인된다는 점이다. 또한 폭염에 따른 전력수요 확대, AI·반도체 산업발 전력 수요, 에너지 자립 강화 등은 원전/전력 인프라 수요를 뒷받침하는 배경으로 해석될 수 있다. 다만 부정적으로는 원자력연구원 원장 선임 지연으로 공백 장기화 우려가 제기됐고, 일부 뉴스는 기장군 이장협 관련 잡음처럼 원전 현안 주변의 비핵심·부정 이슈가 섞여 있다. 제목 기반 자료가 많아 실제 수주, 실적 개선, 대규모 투자 집행, 정책 확정 여부는 충분히 확인되지 않으며, 다수는 기대감 또는 해석성 기사에 머문다. 따라서 테마 분위기는 전반적으로 우호적이지만, 본문으로 검증된 강한 성과 신호가 제한적이어서 보수적으로 중립 평가가 적절하다.",,,,6,24,본문+제목 혼합,True,,59
2026-07-15 20:44:03,유통,48,중립,"긍정적으로 볼 점은 일본 편의점 업계가 의류 판매를 확대하며 자체 브랜드 매출이 매년 30% 이상 증가했고, 인천공항 면세점 영업 허가 연장처럼 일부 유통 채널의 운영 안정성이 확인됐다는 점이다. 또한 외국인 관광객의 성수·명동 쇼핑 수요, 백화점 테마 강세, 소비쿠폰 등 소비 회복 기대를 시사하는 제목들이 다수 나와 전반적인 업황 심리는 나쁘지 않다. 다만 최저임금 인상으로 편의점·카페의 비용 부담이 커진다는 보도와 슈퍼마켓 수익성 악화 우려처럼 부정적 요인도 함께 확인된다. 본문이 있는 기사들은 특정 사례 중심이라 유통업 전반의 실적 개선이나 대규모 수요 증가를 직접 입증하진 못하며, 상당수는 제목만 확인돼 기대감이 과도하게 반영되지 않도록 보수적으로 봐야 한다.",,,,5,25,본문+제목 혼합,True,,35
2026-07-15 20:44:46,인프라/배당,48,중립,"본문에서 확인된 긍정 요인은 리츠 소액주주들이 정상화와 이사회 참여를 추진하고, 해외 인컴펀드의 중간배당 발표처럼 배당 관련 이벤트가 이어졌다는 점이다. 또 KT의 분기배당 결정, 남양유업과 엔비티의 자사주 소각·배당 검토, 주주환원 강화 관련 기사들은 배당 및 환원 테마의 관심을 높이는 재료로 볼 수 있다. 인프라 측면에서는 KT의 AI·네트워크 인프라 점검과 선진국의 인프라 수명연장 관련 기사처럼 유지·교체 수요를 시사하는 흐름이 보인다. 다만 본문 기반 기사는 4건에 그치고, 상당수는 제목 기반 자료라 확인 강도가 낮으며, JR글로벌리츠 법정관리 이슈와 리츠 관련 리스크 기사도 있어 테마 전반이 강한 호재 일변도라고 보기는 어렵다. 따라서 현재 분위기는 배당·주주환원 선호와 인프라 유지보수 수요 기대가 섞여 있으나, 실적·수주·정책 효과가 본문에서 대규모로 확인된 수준은 아니다.",,,,4,26,본문+제목 혼합,True,,49
2026-07-15 20:45:34,자동차,52,중립,"본문 기준으로는 토요타의 GR GT 슈퍼카 공개와 라브4 하이브리드 시승기처럼 하이브리드·고성능차 관련 신차 소식이 확인되어, 기술 고도화와 제품 경쟁력 측면에서는 긍정적으로 볼 수 있다. 또한 자동차 수출이 6월 기준 역대 최대라는 제목 기사들이 다수 보여 수출 흐름 자체는 양호한 분위기가 감지된다. 반면 현대차·기아 및 부품사 파업, 생산 중단 우려 등 공급 차질 이슈가 반복적으로 등장해 업황 개선 효과를 제약할 수 있다. 전기차·하이브리드 확대, 중국 전기차의 국내 공략, 가격 경쟁 심화 같은 내용도 혼재해 있어 전반적으로는 개선 기대와 리스크가 함께 존재한다. 다만 상당수 뉴스가 제목 기반이어서 실제 수요 증가나 실적 개선이 본문에서 충분히 확인된 것은 아니므로, 해석에는 한계가 있다.",,,,6,24,본문+제목 혼합,True,,48
2026-07-15 20:46:40,전력인프라,72,긍정,"전력인프라 테마는 AI 데이터센터, 반도체 클러스터, 전력망 증설과 관련된 수요 확대가 본문에서 여러 차례 확인되어 전반적으로 긍정적인 분위기다. 특히 가온전선의 용인 반도체 클러스터 배전케이블 공급, LS Electric의 북미 데이터센터 수주 확대와 실적 개선 전망, 그리고 미국 전력망의 AI 수요 대응 부족 등은 전력기기·배전·변압기 관련 수요가 구조적으로 늘고 있음을 시사한다. 또한 전력기기 3사의 호실적 예고, ESS를 통한 전력망 병목 해소, 전력인프라 기업들의 해외 시장 확장 기대도 우호적 요인으로 볼 수 있다. 다만 다수 뉴스가 제목 중심이어서 실제 계약 규모, 매출 반영 시점, 수익성 개선 여부는 제한적으로만 확인되며, 일부 기사는 전망성 표현에 그친다. 따라서 테마 분위기는 분명 개선됐지만, 본문에서 확인된 실적·수주 사례와 아직 확인되지 않은 기대감이 섞인 상태로 보는 것이 보수적이다.",,,,6,24,본문+제목 혼합,True,,69
2026-07-15 20:47:26,전자부품/PCB,63,긍정,"본문 기준으로는 전자부품/PCB 테마에 대해 AI 데이터센터와 반도체 고도화 수요가 이어지며, 유리기판용 CMP 하부 패드 공동개발, AI 서버용 고성능 MLCC 양산 본격화, AI PCB 수요 확대와 관련된 실적 개선 기대가 확인되어 전반적 분위기는 우호적이다. 또한 삼성전기 등 기판·MLCC 업체의 수익성 개선, DDR5/HBM용 메모리 모듈 PCB 공급 확대 기대, 글로벌 AI 투자 확대에 따른 PCB·MLCC 병목 수혜 가능성도 뉴스에서 제시됐다. 다만 다수의 자료가 제목 중심의 기대감 또는 주가 급등 기사에 의존하고 있어 실제 수주 규모, 양산 매출 반영, 고객사 확정 여부는 아직 제한적으로 확인된다. 한편 검찰의 반도체 부품 가격 담합 압수수색 보도는 공급망 관련 규제 리스크와 업계 이미지 훼손 가능성을 시사해 일부 부정 요인으로 작용한다. 종합하면 실적·수요 모멘텀은 긍정적이지만, 본문 확인 범위가 제한적이고 규제 이슈가 섞여 있어 과도하게 낙관하기는 어렵다.",,,,6,24,본문+제목 혼합,True,,49
